paper_id,doi,title,first_author,year,journal,has_pdf,FINAL_EXCLUSION_CODE,FINAL_FAILED_CRITERION
36,10.1002/oby.70181,Associations of Screen Time and Physical Activity With Body Mass Index in Early Adolescence: A Prospective Cohort Study.,"Nagata, Jason M",2026,"Obesity (Silver Spring, Md.)",1,FT-EC2,FT_IC2
67,10.1007/s12519-025-01009-y,Prospective associations between media parenting practices and adolescent video game use.,"Nagata, Jason M",2026,World journal of pediatrics : WJP,1,FT-EC2,FT_IC2
143,10.1016/j.lana.2025.101002,"Cyberbullying, mental health, and substance use experimentation among early adolescents: a prospective cohort study.","Nagata, Jason M",2025,Lancet regional health. Americas,1,FT-EC2,FT_IC2
7,10.1001/jamanetworkopen.2023.41502,Shared Genetic Risk in the Association of Screen Time With Psychiatric Problems in Children.,"Zhang, Yingzhe",2023,JAMA network open,1,FT-EC2,FT_IC2
440,10.1556/2006.2023.00006,Brain structural co-development is associated with internalizing symptoms two years later in the ABCD cohort.,"Zhao, Yihong",2023,Journal of behavioral addictions,1,FT-EC2,FT_IC2
59,10.1007/s10964-023-01907-2,"The association between adverse childhood experiences (ACEs), bullying victimization, and internalizing and externalizing problems among early adolescents …",N Trompeter,,Springer,1,FT-EC2,FT_IC2
130,10.1016/j.jadohealth.2021.11.023,The Pandemic's Toll on Young Adolescents: Prevention and Intervention Targets to Preserve Their Mental Health.,"Kiss, Orsolya",2022,The Journal of adolescent health : official publication of the Society for Adolescent Medicine,1,FT-EC4,FT_IC3
81,10.1016/j.acap.2024.102624,Cyberbullying Victimization Among Transgender and Gender-Questioning Early Adolescents.,"Nagata, Jason M",2025,Academic pediatrics,1,FT-EC2,FT_IC2
82,10.1016/j.acap.2025.102784,Prevalence and Patterns of Social Media Use in Early Adolescents.,"Nagata, Jason M",2025,Academic pediatrics,1,FT-EC4,FT_IC3
534,10.3389/fpsyt.2026.1756782,ADHD and gaming addiction in adolescents: psychosocial mediators in the adolescent brain cognitive development study.,"Lopez, Daniel A",2026,Frontiers in psychiatry,1,FT-EC2,FT_IC2
30,10.1002/jad.12124,Adverse childhood experiences and early adolescent cyberbullying in the United States.,"Nagata, Jason M",2023,Journal of adolescence,1,FT-EC2,FT_IC2
78,10.1016/j.acap.2022.12.007,Cyberbullying and Sleep Disturbance Among Early Adolescents in the U.S.,"Nagata, Jason M",2023,Academic pediatrics,1,FT-EC2,FT_IC2
186,10.1038/s41398-025-03467-4,Neural correlates differ between crystallized and fluid intelligence in adolescents.,"Qiu, Bowen",2025,Translational psychiatry,1,FT-EC2,FT_IC2
194,10.1038/s41598-025-88398-2,Neurocognitive and brain structure correlates of reading and television habits in early adolescence.,"Rauschecker, Andreas M",2025,Scientific reports,1,FT-EC2,FT_IC2
172,10.1037/ccp0000912,Evaluating hypothetical prevention strategies for internalizing symptoms in the general population and at-risk children.,"Dall'Aglio, Lorenza",2025,Journal of consulting and clinical psychology,1,FT-EC2,FT_IC2
129,10.1016/j.jadohealth.2021.11.008,Transforming the Future of Adolescent Health: Opportunities From the Adolescent Brain Cognitive Development Study,Elizabeth A. Hoffman,2021,Journal of Adolescent Health,1,FT-EC2,FT_IC2
166,10.1017/s0033291719001545,"Demographic, psychological, behavioral, and cognitive correlates of BMI in youth: Findings from the Adolescent Brain Cognitive Development (ABCD) study.","Gray, Joshua C",2020,Psychological medicine,1,FT-EC2,FT_IC2
181,10.1038/s41366-025-01980-6,Prospective associations of sleep duration and screen time with transition from overweight/obesity to normal BMI in U.S. adolescents.,"Al-Shoaibi, Abubakr A",2025,International journal of obesity (2005),1,FT-EC2,FT_IC2
215,10.1089/chi.2025.0022,Independent and Joint Prospective Associations of Screen Time and Sleep Disturbance with Body Mass Index and Waist Circumference Among U.S. Adolescents.,"Al-Shoaibi, Abubakr A",2025,Childhood obesity (Print),1,FT-EC2,FT_IC2
79,10.1016/j.acap.2023.11.019,The Association between Family Environment and Subsequent Risk of Cyberbullying Victimization in Adolescents.,"Shao, Iris Y",2024,Academic pediatrics,1,FT-EC2,FT_IC2
377,10.1177/00111287241305057,Traumatic Stress Exposure as a Predictor of Dual Systems Model Development: Examining Deviant Peer Association as a Social Mediating Mechanism,Thomas Wojciechowski,2024,Crime & Delinquency,1,FT-EC2,FT_IC2
291,10.1111/apa.17365,Problematic smartphone use: What can teenagers and parents do to reduce use?,Nicola J. Kalk,2024,Acta Paediatrica,1,FT-EC3,FT_IC5
205,10.1080/08927936.2024.2406097,Pet Ownership and Family Involvement in Sports and Other Activities.,"Halbreich, Eli D",2024,Anthrozoos,1,FT-EC2,FT_IC2
239,10.1097/01.ee9.0000606160.27107.76,"Radiofrequency electromagnetic fields exposure, screen time and cognitive function in children and adolescents at 9-18 years old",Alba Cabré-Riera,2019,Environmental Epidemiology,1,FT-EC1,FT_IC1
541,10.3390/ijerph18020699,Typologies of Family Functioning and 24-h Movement Behaviors.,"Guerrero, Michelle D",2021,International journal of environmental research and public health,1,FT-EC2,FT_IC2
83,10.1016/j.acap.2025.103164,Neighborhood Quality and Screen Use: Findings From the Adolescent Brain Cognitive Development Study.,"Nagata, Jason M",2026,Academic pediatrics,0,FT-EC2,FT_IC2
179,10.1037/pha0000532,One-year predictions of delayed reward discounting in the adolescent brain cognitive development study.,"Owens, Max M",2022,Experimental and clinical psychopharmacology,1,FT-EC2,FT_IC2
392,10.1186/s12889-024-18790-6,Association of physical activity and screen time with cardiovascular disease risk in the Adolescent Brain Cognitive Development Study.,"Nagata, Jason M",2024,BMC public health,1,FT-EC2,FT_IC2
446,10.1556/2006.2025.00103,Connectome-based predictive modelling of problematic gaming in youth from the ABCD study.,"Park, Jennifer J",2026,Journal of behavioral addictions,1,FT-EC2,FT_IC2
84,10.1016/j.actpsy.2026.106742,The association between screen time and cognitive function in children: The partially mediating role of putamen volume.,"Shou, Qiulu",2026,Acta psychologica,1,FT-EC2,FT_IC2
475,10.2196/75126,"Associations Among Cyberbullying Victimization, Inhibitory Control, Neural Activation of Error Processing, and Mental Health Problems in Adolescents: Neuroimaging, Retrospective Longitudinal Cohort Study Using the Adolescent Brain Cognitive Development Data",Xuanyu Zhang,2026,Journal of Medical Internet Research,1,FT-EC2,FT_IC2
420,10.1371/journal.pone.0256591,"Screen time and early adolescent mental health, academic, and social outcomes in 9- and 10- year old children: Utilizing the Adolescent Brain Cognitive Development ℠ (ABCD) Study.","Paulich, Katie N",2021,PloS one,1,FT-EC2,FT_IC2
473,10.2196/29426,Passive Sensing of Preteens' Smartphone Use: An Adolescent Brain Cognitive Development (ABCD) Cohort Substudy.,"Wade, Natasha E",2021,JMIR mental health,1,FT-EC3,FT_IC5
193,10.1038/s41598-024-68467-8,Passively sensing smartphone use in teens with rates of use by sex and across operating systems.,"Alexander, Jordan D",2024,Scientific reports,1,FT-EC3,FT_IC5
103,10.1016/j.dcn.2024.101388,NowIKnowMyABCD: A global resource hub for researchers using data from the ABCD Study.,"Ali, Sana A",2024,Developmental cognitive neuroscience,1,FT-EC2,FT_IC2
126,10.1016/j.jadohealth.2019.12.005,Sleep Disturbance Predicts Depression Symptoms in Early Adolescence: Initial Findings From the Adolescent Brain Cognitive Development Study.,"Goldstone, Aimée",2020,The Journal of adolescent health : official publication of the Society for Adolescent Medicine,1,FT-EC2,FT_IC2
445,10.1556/2006.2025.00094,Situating problematic gaming and psychotic-like experiences in the adolescent landscape of affordances: A cohort study.,"Paquin, Vincent",2026,Journal of behavioral addictions,1,FT-EC2,FT_IC2
10,10.1001/jamanetworkopen.2025.28532,Psychopathology and Gaming Disorder in Adolescents.,"Falcione, Kylie",2025,JAMA network open,1,FT-EC2,FT_IC2
77,10.1016/j.acap.2022.07.007,"Associations Between Adverse Childhood Experiences, Adolescent Screen Time and Physical Activity During the COVID-19 Pandemic.","Raney, Julia H",2022,Academic pediatrics,1,FT-EC2,FT_IC2
116,10.1016/j.ijheh.2018.09.006,"Radiofrequency electromagnetic fields, screen time, and emotional and behavioural problems in 5-year-old children.","Guxens, Mònica",2019,International journal of hygiene and environmental health,1,FT-EC1,FT_IC1
98,10.1016/j.dcn.2018.03.008,"Current, future and potential use of mobile and wearable technologies and social media data in the ABCD study to increase understanding of contributors to child health.","Bagot, K S",2018,Developmental cognitive neuroscience,1,FT-EC3,FT_IC5
384,10.1186/s12887-024-05367-w,Associations between media parenting practices and early adolescent consumption of R-rated movies and mature-rated video games.,"Nagata, Jason M",2025,BMC pediatrics,1,FT-EC2,FT_IC2
176,10.1037/hea0001248,Longitudinal relationships between lifestyle risk factors and neurodevelopment in early adolescence.,"Mewton, Louise",2023,"Health psychology : official journal of the Division of Health Psychology, American Psychological Association",1,FT-EC2,FT_IC2
112,10.1016/j.envres.2016.06.021,"Outdoor and indoor sources of residential radiofrequency electromagnetic fields, personal cell phone and cordless phone use, and cognitive function in 5-6 years old children.","Guxens, Mònica",2016,Environmental research,1,FT-EC1,FT_IC1
434,10.1542/peds.2025-073891/206084,Sociodemographic Associations With Early Smartphone Ownership in US Adolescents,CA Carvalho,,publications.aap.org,1,FT-EC7,FT_EC7
91,10.1016/j.bpsc.2021.02.013,Identification and Validation of Distinct Latent Neurodevelopmental Profiles in the Adolescent Brain and Cognitive Development Study.,"Lichenstein, Sarah D",2022,Biological psychiatry. Cognitive neuroscience and neuroimaging,1,FT-EC2,FT_IC2
153,10.1016/j.pmedr.2023.102428,Identification and characterization of screen use trajectories from late childhood to adolescence in a US-population based cohort study.,"Shao, Iris Yuefan",2023,Preventive medicine reports,1,FT-EC2,FT_IC2
185,10.1038/s41398-023-02502-6,Generalizable prediction of childhood ADHD symptoms from neurocognitive testing and youth characteristics.,"Weigard, Alexander",2023,Translational psychiatry,1,FT-EC2,FT_IC2
433,10.1542/peds.2025-073891,Sociodemographic Associations With Early Smartphone Ownership in US Adolescents,Cory Alika Carvalho,2026,PEDIATRICS,1,FT-EC7,FT_EC7
397,10.1186/s12889-026-26756-z,Higher recreational screen time and lower step count are associated with higher cardiovascular disease risk in early adolescence,Jason M. Nagata,2026,BMC Public Health,1,FT-EC2,FT_IC2
122,10.1016/j.jaacop.2025.11.011,Developmental Pathways From Childhood Neurodevelopmental Traits to Early Adolescent Psychiatric Dimensions: The Role of Environmental and Lifestyle Factors.,"Caserini, Chiara",2026,JAACAP open,1,FT-EC2,FT_IC2
306,10.1111/jcpp.14179,Trajectories of psychotic-like experiences in youth and associations with lifestyle factors.,"Cooper, Rebecca",2026,"Journal of child psychology and psychiatry, and allied disciplines",0,FT-EC2,FT_IC2
178,10.1037/hea0001351,Leveraging the adolescent brain cognitive development study to advance and promote adolescent health: Introduction to the special issue.,"Sanchez, Mariana",2023,"Health psychology : official journal of the Division of Health Psychology, American Psychological Association",1,FT-EC3,FT_IC5
13,10.1001/jamapediatrics.2025.1718,Role of Sleep and White Matter in the Link Between Screen Time and Depression in Childhood and Early Adolescence.,"Lima Santos, João Paulo",2025,JAMA pediatrics,0,FT-EC2,FT_IC2
305,10.1111/jcpp.14155,"Sexual and gender minority identity, peer victimization, and suicidality in adolescents: A mediation study using the ABCD Study.","Liu, Sen",2025,"Journal of child psychology and psychiatry, and allied disciplines",0,FT-EC2,FT_IC2
141,10.1016/j.jpeds.2021.08.077,Sociodemographic Correlates of Contemporary Screen Time Use among 9- and 10-Year-Old Children.,"Nagata, Jason M",2022,The Journal of pediatrics,1,FT-EC2,FT_IC2
309,10.1111/jora.70076,Bidirectional associations of problematic social media use and problematic gaming with mental health difficulties and strengths in adolescents: Sex and social support …,L Todorovic,,Wiley Online Library,1,FT-EC1,FT_IC1
187,10.1038/s41398-025-03672-1,Association of screen time with attention-deficit/hyperactivity disorder symptoms and their development: the mediating role of brain structure.,"Shou, Qiulu",2025,Translational psychiatry,1,FT-EC2,FT_IC2
132,10.1016/j.jadohealth.2022.10.019,Adherence to 24-Hour Movement Recommendations and Health Indicators in Early Adolescence: Cross-Sectional and Longitudinal Associations in the Adolescent Brain Cognitive Development Study.,"Fung, Hoki",2023,The Journal of adolescent health : official publication of the Society for Adolescent Medicine,1,FT-EC2,FT_IC2
105,10.1016/j.drugalcdep.2023.110920,Association of cyberbullying victimization and substance initiation: The Adolescent Brain Cognitive Development (ABCD) study,Iris Yuefan Shao,2023,Drug and Alcohol Dependence,1,FT-EC2,FT_IC2
292,10.1111/apa.70051,Cyberbullying Victimisation Was Associated With Greater Manic Symptoms in Early Adolescence: A Prospective Cohort Study.,"Nagata, Jason M",2025,"Acta paediatrica (Oslo, Norway : 1992)",1,FT-EC2,FT_IC2
