paper_id,title,authors,year,doi,has_pdf,FINAL_decision,FINAL_EC_code,FINAL_reason,FT_IC1_C1,FT_IC1_C2,FT_IC1_Resolver,FT_IC1_FINAL,FT_IC1_C1_evidence,FT_IC1_C2_evidence,FT_IC1_Resolver_rationale,FT_IC2_C1,FT_IC2_C2,FT_IC2_Resolver,FT_IC2_FINAL,FT_IC2_C1_evidence,FT_IC2_C2_evidence,FT_IC2_Resolver_rationale,FT_IC3_C1,FT_IC3_C2,FT_IC3_Resolver,FT_IC3_FINAL,FT_IC3_C1_evidence,FT_IC3_C2_evidence,FT_IC3_Resolver_rationale,FT_IC4_C1,FT_IC4_C2,FT_IC4_Resolver,FT_IC4_FINAL,FT_IC4_C1_evidence,FT_IC4_C2_evidence,FT_IC4_Resolver_rationale,FT_IC5_C1,FT_IC5_C2,FT_IC5_Resolver,FT_IC5_FINAL,FT_IC5_C1_evidence,FT_IC5_C2_evidence,FT_IC5_Resolver_rationale,FT_IC6_C1,FT_IC6_C2,FT_IC6_Resolver,FT_IC6_FINAL,FT_IC6_C1_evidence,FT_IC6_C2_evidence,FT_IC6_Resolver_rationale,FT_EC7_applies_C1,FT_EC7_applies_C2,FT_EC7_applies_Resolver,FT_EC7_applies_FINAL,FT_EC7_applies_C1_evidence,FT_EC7_applies_C2_evidence,FT_EC7_applies_Resolver_rationale
164,Associations between 24 hour movement behaviours and global cognition in US children: a cross-sectional observational study.,,2018,10.1016/s2352-4642(18)30278-5,False,EXCLUDE,FT-EC2,FT_IC2 = NOT_MET,MET,MET,,MET,"US ABCD Study, first annual curated release, 4524 participants aged 8-11 from 20 US study sites","US ABCD Study, first annual release, 4524 US children aged 8-11 years from 20 study sites",,NOT_MET,NOT_MET,,NOT_MET,Screen time (recreational TV/screen) only; no qualifying smartphone or social media variable (B5: TV-only),"Exposure is 'recreational screen time' without further breakdown. Abstract and methods state 'recreational screen time' as a guideline adherence category. No separate per-item breakdown for smartphone use, SM platform use, app use, texting, or video chat. Applies B2 (summed/total screen time with no per-item breakdown).",,MET,MET,,MET,Multivariable linear mixed-effects models examining relations with movement behaviour variables,"Multivariable linear mixed-effects regression with β coefficients reported (e.g., β=1.44, 95% CI 0.82-2.07 for each additional recommendation met)",,MET,MET,,MET,"Multiple β coefficients reported: e.g., β=1.44 (95% CI 0.82–2.07, p<0.0001) for each additional recommendation met; β=4.25 (2.50–6.01, p<0.0001) for screen time recommendation only","Multiple β coefficients with 95% CIs reported in abstract: β=1.44 (95% CI 0.82-2.07), β=3.89 (95% CI 1.43-6.34), β=4.25 (2.50-6.01), β=5.15 (3.56-6.74); also p-values",,MET,MET,,MET,Original empirical analysis using ABCD baseline data with multivariable regression,Original empirical analysis of US ABCD Study data with inferential statistics on movement behaviours and cognition,,MET,MET,,MET,No evidence of preprint/abstract/deposit duplicate,Published 2018 in The Lancet Child & Adolescent Health; no evidence of preprint/duplicate,,FALSE,FALSE,,FALSE,"Paper fails FT_IC2 (no qualifying smartphone/SM variable), so FT_EC7 assessment not applicable",Screen time is NOT the dependent variable—it is a predictor/exposure. Global cognition is the outcome. FT-EC7 only applies when smartphone/SM is the DV in every analysis; this fails condition (a).,
166,"Demographic, psychological, behavioral, and cognitive correlates of BMI in youth: Findings from the Adolescent Brain Cognitive Development (ABCD) study.",,2020,10.1017/s0033291719001545,True,EXCLUDE,FT-EC2,FT_IC2 = NOT_MET,MET,MET,,MET,"Uses ABCD study baseline data (Release 2018), n=4524 initially, n=3847 after QC, 9-10 year olds in US","US ABCD Study, first wave (Release 1.0), 9-10 year olds (N=3847 after QC), nationally representative sample",,NOT_MET,MET,NOT_MET,NOT_MET,"Screen time defined as 'average minutes per week on computer, cellphone, tablet, or other electronic device' - unspecified platform, generic internet use without device/platform breakdown. Per B5 and B7, unspecified-platform use does NOT meet criteria.","Screen time (average minutes per week on computer, cellphone, tablet, or other electronic device) — qualifying smartphone/screen variable; B8 applies: penalized regression (LASSO/Ridge/Elastic net) with traditional regression coefficients reported in main text and figures","B7 rule: 'Paper measures only ""internet use"" without device or platform specification → FT_IC2 = NOT_MET (FT-EC2).' The paper's screen time measure conflates multiple device types (computer, cellphone, tablet, other) into a single unspecified aggregate. While 'cellphone' is mentioned as one component, the measure does not isolate smartphone/mobile use or social media use with its own extractable coefficient. The aggregation across device types without per-device breakdown fails the requirement for a separately-measured smartphone or SM variable. Criteria specify 'Time on smartphone' or 'any app or app-category use' — not generic 'screen time' across mixed devices.",MET,MET,,MET,"Multiple machine learning regression approaches: ridge, LASSO, elastic net, and linear regression with FDR correction. Penalized regression coefficients (LASSO/ridge/elastic-net) count per prompt. Coefficients reported for all approaches.","Multiple machine learning regression approaches (LASSO, Ridge, Elastic net, Linear regression) with 10-fold cross-validation; coefficients and model performance metrics reported; F-statistics and R² values provided",,MET,MET,,MET,"Reports R² (0.12), RMSE (15.97, 17.34), variable importance coefficients in figures (Fig. 1, 2, 3); linear regression reports p=7.5×10^-8 for screen time","Regression coefficients (β weights) shown in Figs. 1-3; RMSE, R² values (training R²=0.12, test R²=0.12 for full sample); p-values for linear regression (e.g., screen time p=7.5×10⁻⁸); FDR-corrected results in Supplementary Fig. S1",,MET,MET,,MET,"Original ABCD empirical analysis examining associations of 43 demographic, psychological, behavioral, cognitive variables with BMI using multiple analytical approaches on training/test split data","Original empirical ABCD analysis examining relative importance of 43 demographic, psychological, behavioral, and cognitive variables in predicting BMI using machine learning",,MET,MET,,MET,"Published original research paper, no indication of duplicate/preprint status","No evidence of preprint/abstract/deposit duplicate; first published online July 10, 2019",,FALSE,FALSE,,FALSE,FT_EC7 does not apply because FT_IC2 is NOT_MET. EC7 criteria only relevant when all IC criteria (including IC2) are MET.,"Condition (a) fails: Screen time is the INDEPENDENT variable (IV) predicting BMI as the dependent variable (DV), not vice versa. Paper contains SM→non-SM-outcome analyses, violating FT-EC7 requirement that SM/smartphone must be DEPENDENT in every analysis",
167,The role of smartphones in adolescent-parent discrepancy in reporting adolescents' internalizing problems.,,2025,10.1017/s0954579425100618,True,INCLUDE,,all criteria MET; FT-EC7 not applicable,MET,MET,,MET,"ABCD Study, Baseline N = 11,878 (White = 52.0%, Hispanic = 20.3%, Black = 15.0%, Asian = 2.1%, Other = 10.5%; Female = 47.8%), tracked across Years 1–4","US ABCD Study, Baseline N=11,878 from Adolescent Brain Cognitive Development study.",,MET,MET,,MET,"Smartphone ownership age of acquisition (parent-reported, multiple waves); meets B1 qualifying criterion for smartphone variable with separate coefficient",Qualifying smartphone variable: smartphone ownership (age of acquisition). Applies B1 (smartphone ownership measured separately).,,MET,MET,,MET,Multi-level modeling with hierarchical linear regression; time × informant interaction testing discrepancy change over time; direct effect of informant (parent vs. child) on internalizing problems modeled,"Regression analysis testing smartphone ownership → parent-child informant discrepancy in internalizing problems (b = -0.21, SE = 0.042, p < 0.001, 95% CI [-0.29, -0.23]).",,MET,MET,,MET,"Main effect regression coefficients reported: b = -0.21, SE = .042, p < .001, 95% CI [-.29, -.23] for full sample trajectory; multi-group model coefficients across smartphone age groups (Table 3)","Numeric coefficients and statistics reported: regression β and SE for main effect; Figure 1 shows multi-group latent growth curve analyses with coefficients (β = 29**, β = -24*, etc.) and p-values.",,MET,MET,,MET,Original ABCD empirical analysis; longitudinal multi-level design across 4 waves; examination of parent-child informant discrepancy trajectories as outcome,Original empirical analysis using ABCD longitudinal data across 4 waves (Years 1-4) examining smartphone ownership impact on parent-child discrepancy.,,MET,MET,,MET,"No detected preprint, abstract, or duplicate publication",Published in Development and Psychopathology (2025); no evidence of preprint/abstract duplicate.,,FALSE,FALSE,,FALSE,"Smartphone ownership is the INDEPENDENT variable predicting internalizing problems (parent-child discrepancy thereof), not the dependent variable. Paper has SM → non-SM-outcome analysis (SM → informant discrepancy in internalizing problems), which directly disqualifies FT-EC7 per § 3.1(a).","Smartphone is NOT the dependent variable. The dependent variable is parent-child informant discrepancy of internalizing problems. Smartphone is the independent variable. This is SM/smartphone → non-SM-outcome analysis, so FT-EC7 does not apply.",
168,"Screen time, problematic media use, and clinical concerns in the ABCD Study: Differences by sex and race/ethnicity.",,2025,10.1017/s0954579425100655,True,INCLUDE,,all criteria MET; FT-EC7 not applicable,MET,MET,,MET,"US ABCD Study, Year 2 time point, ages 11-12 years, N=10,052 youth from 21 sites representing diverse US demographics.","US ABCD Study (4.0 data release from Year 2 follow-up); epidemiologically-informed sample at age 11-12 (N=10,052 youth; 52.3% male, 62.5% non-Hispanic White/European American)",,MET,MET,,MET,"Screen media time per day (parent & youth report, hours/day) and Problematic Media Use Scale (9-item parent report). Qualifies as qualifying SM variables under standard usage-based measures.","Screen media time per day (parent and youth report, hours/day) and problematic media use (9-item Problematic Media Use Measure - Short Form); both qualify as SM variables per B1 (separate item-level assessment; see Table 1 for descriptive statistics)",,MET,MET,,MET,"Multilevel regression models predicting clinical concerns (CBCL internalizing/externalizing, BPM, NSSI, suicidal ideation). Table 2 reports unstandardized coefficients (β) and standard errors.","Multilevel regression models (Imei R package, family=1620 families with random effects) predicting clinical concerns (CBCL, BPM, SI, NSSI); standardized beta coefficients and standard errors reported for all predictors",,MET,MET,,MET,"Table 2 reports standardized β coefficients for screen media use and problematic media use predicting each clinical outcome (CBCL total, internalizing, externalizing; BPM total, internalizing, externalizing).","Standardized beta (β) coefficients with standard errors in Table 2; e.g., problematic media use on CBCL internalizing: β=1.74 (SE=0.07), p<0.001; p-values and effect sizes throughout",,MET,MET,,MET,"Original empirical ABCD analysis examining relations between screen media behaviors and clinical concerns (internalizing, externalizing, suicidal ideation, NSSI) by race/ethnicity and sex.","Original ABCD analysis with multiple SM↔clinical concern coefficients; longitudinal cross-sectional models predicting internalizing/externalizing problems, suicidal ideation (SI), non-suicidal self-injury (NSSI)",,MET,MET,,MET,Published article in Development and Psychopathology 2025. No evidence of duplicate from prior preprint or abstract.,Published in Development and Psychopathology (2025); primary original empirical study; no duplicate evidence,,FALSE,FALSE,,FALSE,"Fails condition (a): Screen time and problematic media use are INDEPENDENT variables predicting clinical outcome variables (internalizing/externalizing problems, suicidal ideation, NSSI), not dependent variables. Paper examines media-use → clinical concerns, not demographics → media-use.","FT-EC7 criterion (a) not met: screen media use and problematic media use are predictors (IVs) predicting clinical outcomes (depression, anxiety, internalizing/externalizing problems), NOT the dependent variables. This is SM→outcome association, opposite of EC7. Criterion (b) not met: models include covariates beyond demographics (age, sex, income, parent education) and examine race/ethnicity stratified analyses.",
172,Evaluating hypothetical prevention strategies for internalizing symptoms in the general population and at-risk children.,,2025,10.1037/ccp0000912,True,EXCLUDE,FT-EC1,FT_IC1 = NOT_MET,NOT_MET,MET,NOT_MET,NOT_MET,"Pooled analysis combining ABCD (N=8,699) with Generation R (Dutch cohort, N=3,739). No US-ABCD-only estimates reported. Per binding rule: pooled analysis with no US-ABCD-only subset fails FT-IC1.","ABCD Study data explicitly mentioned; pooled analysis with ABCD and Generation R, but paper reports ABCD-specific estimates separately per target trial emulation framework","Pooled analysis with Generation R (Dutch cohort) where U.S. ABCD-only estimates are not separately extractable. Per FT-IC1 rule: 'Pooled analysis with another cohort where U.S.-ABCD-only estimates are NOT extractable' triggers FT-EC1. C1 correctly identified this; C2 incorrectly asserted ABCD estimates were separate per TTE framework, but they were not reported separately in results.",MET,NOT_MET,NOT_MET,NOT_MET,"Screen time (ST) measured at age 10, primary exposure. Qualifies under B5 exclusion scope: while TV is mentioned, ST is measured as general screen time inclusive of multiple activities including video/media. Paper reports ST as qualifying exposure for internalizing outcomes analysis.","Screen time is summed/total construct only; paper measures ST, PA, sleep, social support but does not break down qualifying smartphone/social media variables with own coefficients. ST is measured as composite with no per-item breakdown. Applies B2.","Paper measures only total/composite screen time with no per-item breakdown. The abstract describes ST, PA, sleep, and social support as distinct modifiable factors, but results report only the total ST construct. Per B2 (BINDING): 'Paper uses YSTS but reports only a summed total screen time estimate (or a single composite) with no per-modality breakdown anywhere → FT_IC2 = NOT_MET (FT-EC2).' C2 is correct; C1 incorrectly invoked B5 (which applies to TV-only, not composite ST).",MET,MET,,MET,"Target trial emulation (TTE) with causal inference; regression coefficients reported (e.g., β = 0.10–0.16 SDs for ST on internalizing symptoms). Meets definition of inferential test.",Target trial emulation with G-formula; regression-based causal inference method per Table 1 and analytical framework described in Methods,,MET,MET,,MET,"Standardized effect sizes (β in SDs) reported: ST guidelines adherence → internalizing symptoms changes 0.10–0.16 SDs (0–1 hr), 0.07–0.09 SDs (3–4 hr) vs. 2 hr baseline.","G-formula results reported with β coefficients and 95% CIs in text; e.g., 'adhering to more stringent ST guidelines (0–1 hr) decreased internalizing symptoms by 0.10–0.16 SDs' and 'following more lenient guidelines (3–4 hr) increased them by 0.07–0.09 SDs'",,MET,MET,,MET,Original ABCD empirical analysis using target trial emulation methodology to estimate causal effects of modifiable factors.,Original empirical analysis of ABCD data using target trial emulation methodology,,MET,MET,,MET,No indication of preprint/duplicate status.,No evidence of duplicate; published 2025 in Journal of Consulting and Clinical Psychology,,FALSE,FALSE,,FALSE,"Paper does not meet FT-EC7 criteria because: (a) ST is treated as independent variable predicting internalizing symptoms (SM-as-IV → outcome), not as dependent variable; (b) confounders include not just demographics but sleep duration and physical activity (lifestyle factors outside closed demographic set per binding rule B17); (c) at least one analysis is prospective with non-demographic predictors.","Fails condition (a): Screen time is the DEPENDENT variable conceptually but the paper examines SM/ST → internalizing symptoms (outcomes), not the reverse. The analysis also includes other non-demographic predictors (PA, sleep, social support) per condition (b), and B18 applies: paper has both SM-as-DV analyses (longitudinal, demographic) AND SM-as-IV → outcome analyses",
175,Youth electronic media use and family conflict: Bidirectional associations across early adolescence.,,2025,10.1037/fam0001390,True,INCLUDE,,all criteria MET; FT-EC7 not applicable,MET,MET,,MET,"ABCD Study, T1 N = 11,787 with longitudinal follow-up across 3 years","ABCD study, T1 N=11,787 US adolescents followed longitudinally.",,MET,MET,,MET,Electronic media use (overall and type-specific social electronic media); meets B1 criterion for separately reported coefficients by media type,Qualifying electronic media variables: overall electronic media use + specific types including social electronic media (social SM). Applies B1 (separate β for overall and SM-specific types).,,MET,MET,,MET,Longitudinal regression models examining bidirectional associations; separate analyses by electronic media type and gender; cross-lagged design,Longitudinal regression examining bidirectional associations between electronic media use and family conflict across 3 years using cross-lagged panel model.,,MET,MET,,MET,Regression coefficients and significance tests reported for associations between media use at T1 and family conflict at T2 and later timepoints,"Regression coefficients reported in results and supplementary materials; model fit indices provided (CFI, TLI, RMSEA, SRMR).",,MET,MET,,MET,Original ABCD empirical analysis; 3-year longitudinal design examining prospective associations between electronic media use and family conflict,Original empirical analysis using ABCD longitudinal data (T1–T4) examining electronic media use ↔ family conflict associations.,,MET,MET,,MET,No detected duplicate publication,Published in Journal of Family Psychology (2025); no evidence of preprint/abstract duplicate.,,FALSE,FALSE,,FALSE,"Electronic media use is the INDEPENDENT variable predicting family conflict (outcome), not the dependent variable. Paper has SM/media → non-SM-outcome analysis (SM → family conflict), which disqualifies EC7 per § 3.1(a). Additionally, family conflict is not in the closed demographic-only predictor set, and analysis includes bidirectional cross-lagged effects (B20).","Electronic media/social media is used as both IV (predicting family conflict) and as a DV in cross-lagged models (B20 — bidirectional/cross-lagged design). FT-EC7 does not apply per B20 rule. Additionally, family conflict is a non-demographic outcome, so even SM→family conflict analysis alone would disqualify FT-EC7.",
176,Longitudinal relationships between lifestyle risk factors and neurodevelopment in early adolescence.,,2023,10.1037/hea0001248,True,EXCLUDE,FT-EC2,FT_IC2 = NOT_MET,MET,MET,,MET,"US ABCD Study Data Release 3.0; 11,878 participants at baseline (ages 9-10), 6,571 at 2-year follow-up (ages 11-12)","ABCD Study Data Release 3.0; US-based sample recruited through schools at 21 sites across the United States (Garavan et al., 2018)",,NOT_MET,MET,NOT_MET,NOT_MET,"Screen time included but measured ONLY as part of a summed/latent lifestyle risk factor domain (sleep, physical activity, BMI, screen time). No separate coefficient reported for screen time as an independent variable. Violates B2: 'YSTS papers reporting only summed/total screen time with no per-item breakdown anywhere → NOT_MET'","Screen time (Youth Screen Time Survey, self-reported recreational screen time on weekdays/weekends) — qualifies as smartphone/screen exposure per B5 (not TV-only). Modeled as component of lifestyle risk factor latent domain. NOT cyberbullying-only per B3.","Screen time is one of four variables embedded in a single latent lifestyle risk factor. Only the latent construct coefficient is reported (Table 2 shows 'lifestyle risk' domain pathway coefficients, not screen time separately). Per B11 (BINDING): 'SM is one of multiple variables loading on a single latent score, and only the latent score's coefficient is reported → FT_IC2 = NOT_MET (FT-EC2).' C1 correctly applied B11; C2 misinterpreted the latent structure as qualifying because screen time is 'measured.' It must be separately extractable to qualify.",MET,MET,,MET,"Bivariate multiple indicator latent change score models with regression-based path analysis examining relationships between lifestyle risk factor domain and brain volume domains over time. Multiple pathways tested (baseline covariance, path γ2, path γ1, correlated change ρ).","Regression (latent change score models, bivariate mixed-effects paths γ1, γ2, ρ, Φ) testing screen time ↔ brain structure (gray matter volume). Mixed-effects coefficients with p-values reported.",,MET,MET,,MET,"Table 2 reports standardized regression coefficients (β), Z-scores, p-values, and 95% confidence intervals for all bivariate paths. For example: temporal-parietal domain shows β = −0.134 (0.044), Z = −3.059, p = .002 for health risk predicting brain volume change.","Numeric β, Z-scores, p-values, 95% CIs in Table 2 (main results). Example: temporal-parietal domain β = −0.197 (SE 0.026), Z = −7.661, p < .001; health risk → ΔVolume γ2 β = −0.134 (0.044), Z = −3.059, p = .002.",,MET,MET,,MET,Original ABCD empirical analysis investigating longitudinal relationships between clustered lifestyle risk factors (including screen time) and brain structure across two timepoints.,"Original empirical analysis on ABCD Study; longitudinal design with two waves (baseline, 2-year follow-up); bivariate latent change score modeling of lifestyle risk → brain structure.",,MET,MET,,MET,"Published in Health Psychology, 2023. No evidence of preprint/abstract/deposit duplicate. Registered as original study.",Published 2023 in Health Psychology; no evidence of prior preprint/abstract/deposit duplicate.,,FALSE,FALSE,,FALSE,"Does not apply. Condition (a) fails: Screen time is NOT the dependent variable—it is part of an IV (lifestyle risk factor domain) predicting brain volume. The paper has multiple SM/screen-time → non-SM-outcome analyses (screen time predicting brain structure), so the exclusive-DV criterion is not met.","Condition (a) fails: Screen time is NOT the dependent variable. Screen time (as part of lifestyle risk factor latent domain) is an independent variable predicting brain volume (dependent outcome); brain structure is the non-SM outcome of interest. Paper tests lifestyle risk factors → brain outcomes, not SM ← demographics.",
177,Effects of the COVID-19 pandemic on screen time and sleep in early adolescents.,,2023,10.1037/hea0001251,True,INCLUDE,,all criteria MET; FT-EC7 not applicable,MET,MET,,MET,"ABCD Study; 5,027 adolescents assessed before pandemic (10-13 years) and across six time points May 2020 - March 2021 during pandemic.","ABCD Study with 5,027 adolescents assessed pre-pandemic (year 2, ages 10-13) and across 6 pandemic timepoints (May 2020-March 2021)",,MET,MET,,MET,"Social media use (platform-unspecified) and video gaming separately measured and reported. Abstract: 'Higher social media use and video gaming were associated with shorter time in bed, later bedtimes, and longer sleep onset latency.' Qualifies per B1 (separately-measured SM and gaming with own coefficients in mixed-effects models).",Qualifying SM: social media use (hours/day); qualifying video gaming: single-player video game time. Both measured separately with distinct coefficients in LMM. Applies B1: separate β for each screen domain,,MET,MET,,MET,"Mixed-effect models examining associations between self-reported sleep and screen time (social media, video gaming) using longitudinal data; regression coefficients reported.","Linear mixed models (LMM, GLMM) with unstandardized regression coefficients for social media time and video game time predicting sleep outcomes (time in bed, bedtime, sleep onset latency, awakenings)",,MET,MET,,MET,"Regression coefficients and statistical test results reported in main text describing associations between social media use, video gaming, and sleep outcomes (time in bed, bedtimes, sleep onset latency).","Unstandardized β coefficients reported (e.g., social media χ²(1)=114.56, p<.01; video games χ²(1)=6.13, p=.013; simple slope coefficients cited, e.g., slope=-0.24, p<.01). Test statistics and p-values reported for each screen variable; coefficient magnitudes estimated from model output",,MET,MET,,MET,"Original empirical analysis of ABCD Study data examining longitudinal associations between screen time behaviors (social media, video gaming) and sleep outcomes before and during COVID-19 pandemic.",Original empirical analysis of ABCD data; longitudinal mixed-effects models examining associations between screen time and sleep before/during pandemic,,MET,MET,,MET,Published original article; no evidence of duplicate.,Original 2023 publication (Health Psychology); no preprint/abstract/deposit duplicate evident,,FALSE,FALSE,,FALSE,"SM is independent variable predicting sleep outcome (dependent variable), not SM as dependent variable. FT-EC7 requires SM as DV in EVERY analysis; this paper has SM → sleep outcome pattern, failing condition (a).","SM (social media use) is predictor/IV, not dependent variable; predicts sleep outcomes (TIB, bedtime, latency), not vice versa. Fails condition (a). Also includes non-demographic predictors (assessment date, school status, age-by-assessment interaction), failing condition (b) if SM were DV",
