paper_id,doi,title,first_author,year,journal,has_pdf,L1_decision,FT_IC1_C1,FT_IC1_C2,FT_IC1_RESOLVE,FT_IC1_FINAL,FT_IC1_C1_evidence,FT_IC1_C2_evidence,FT_IC1_RESOLVE_evidence,FT_IC2_C1,FT_IC2_C2,FT_IC2_RESOLVE,FT_IC2_FINAL,FT_IC2_C1_evidence,FT_IC2_C2_evidence,FT_IC2_RESOLVE_evidence,FT_IC3_C1,FT_IC3_C2,FT_IC3_RESOLVE,FT_IC3_FINAL,FT_IC3_C1_evidence,FT_IC3_C2_evidence,FT_IC3_RESOLVE_evidence,FT_IC4_C1,FT_IC4_C2,FT_IC4_RESOLVE,FT_IC4_FINAL,FT_IC4_C1_evidence,FT_IC4_C2_evidence,FT_IC4_RESOLVE_evidence,FT_IC5_C1,FT_IC5_C2,FT_IC5_RESOLVE,FT_IC5_FINAL,FT_IC5_C1_evidence,FT_IC5_C2_evidence,FT_IC5_RESOLVE_evidence,FT_IC6_C1,FT_IC6_C2,FT_IC6_RESOLVE,FT_IC6_FINAL,FT_IC6_C1_evidence,FT_IC6_C2_evidence,FT_IC6_RESOLVE_evidence,FT_EC7_C1,FT_EC7_C2,FT_EC7_RESOLVE,FT_EC7_FINAL,FINAL_DECISION,FINAL_EXCLUSION_CODE,FINAL_FAILED_CRITERION
154,10.1016/j.psychres.2025.116523,"Adolescent smartphone use, sleep, and physical activity: daily associations between sensor-based measures in the adolescent brain cognitive development (ABCD) study.","Alexander, Jordan D",2025,Psychiatry research,1,INCLUDE,MET,MET,,MET,"Uses ABCD Study data: 791 Adolescent Brain Cognitive Development Study participants, Mage=14.12, 53% female, with EARS passive sensing data",Title states 'adolescent brain cognitive development (ABCD) study' and abstract absent but title explicitly indicates U.S. ABCD Study.,,MET,MET,,MET,"Smartphone application use measured via EARS (Effortless Assessment Research System) passive sensing; reported by time window: daytime/evening (6AM-7:59PM), late-evening (8PM-9:59PM), late-night (10PM-5:59AM). Specific smartphone exposure variable.",Title indicates sensor-based smartphone use measures (EARS = passive sensing app categories). Sensor-based smartphone measures and app category data qualify as screen exposure variables.,,MET,UNKNOWN,,UNKNOWN,"Mixed-effects models with multiple statistical tests: daytime/evening app use predicted reduced exercise, sedentary time, daily steps; late-night use predicted reduced sleep, delayed sleep onset/waking, increased sedentary time, reduced steps. P<.001 reported throughout.",No PDF available to verify whether daily associations reported include screen↔non-screen inferential tests (sleep and physical activity are non-screen outcomes mentioned in title). Title indicates associations but cannot confirm statistics without full-text.,,MET,UNKNOWN,,UNKNOWN,Standardized beta coefficients reported: daytime/evening β=-0.21 to -0.07 (P<.001); late-evening β=-0.05 to -0.02 (P<.001); late-night β=-0.16 to -0.27 (P<.001). Within-person coefficients: daytime/evening β=-0.22 to -0.07 (P<.001); late-evening β=-0.05 to -0.02 (P<.001); late-night β=-0.16 to -0.24 (P≤.002).,No PDF available; cannot verify numeric coefficients reported in results.,,MET,UNKNOWN,,UNKNOWN,Original empirical analysis: prospective sensor-based study with mixed-effects models examining daily associations between smartphone use and sleep/physical activity over 3 weeks,Title indicates daily associations and sensor-based approach but no PDF to confirm study design and whether original empirical analysis of ABCD data is conducted.,,MET,MET,,MET,"Published journal article in Psychiatry Research, 2025","Appears to be peer-reviewed journal article (Psychiatry Research, 2025). Assume MET unless clear evidence of preprint/abstract/deposit status.",,False,False,,False,UNSURE,,
48,10.1007/s00127-024-02669-3,"Childhood internalizing, externalizing and attention symptoms predict changes in social and nonsocial screen time.","Keyes, Katherine",2024,Social psychiatry and psychiatric epidemiology,1,INCLUDE,MET,MET,,MET,"U.S. ABCD Study at baseline (9-10 years) and 1-year follow-up, N=9,066","Uses U.S. ABCD Study data (Adolescent Brain Cognitive Development Study) at baseline and 1-year follow-up, N=9,066 children aged 9-10 primarily.",,MET,MET,,MET,"Social screen time (social media, texting, video chatting) and nonsocial screen time (YouTube, video games) measured separately as trichotomized weekday and weekend variables","Measures specific smartphone/SM variables: social screen time (social media, texting, video chatting) and nonsocial screen time (YouTube, video games) separately on weekdays and weekends.",,MET,MET,,MET,"Logistic regressions: psychiatric symptoms predicting screen time (weekday nonsocial OR=1.22, 95% CI 1.22-1.23; weekend nonsocial OR=1.10, 95% CI 1.09-1.10; clinical rule-breaking predicting weekday nonsocial OR=1.65, 95% CI 1.63-1.67). Also bidirectional: screen time predicting future psychiatric symptoms","Reports inferential statistical tests (logistic regression with odds ratios) linking psychiatric symptoms as predictors to screen time outcomes one year later, controlled for covariates. Also tests reverse direction: screen time predicting future psychiatric symptoms. Examples: OR=1.22 (95% CI 1.22-1.23) for clinical total psychiatric problems predicting weekday nonsocial screen time; OR=1.15 (95% CI 1.10-1.12) for higher social screen time predicting future ADHD.",,MET,MET,,MET,"Multiple odds ratios with confidence intervals reported throughout: OR=1.22 (95% CI 1.22-1.23), OR=1.10 (95% CI 1.09-1.10), OR=1.65 (95% CI 1.63-1.67)","Multiple odds ratios reported in text, tables, and figures with 95% confidence intervals throughout. Examples: OR=1.22, 95% CI 1.22-1.23; OR=1.65, 95% CI 1.63-1.67; OR=1.15, 95% CI 1.10-1.12.",,MET,MET,,MET,"Original longitudinal empirical analysis: psychiatric symptoms at baseline predicting changes in screen time at 1-year follow-up, controlled for baseline screen use","Original empirical ABCD analysis: longitudinal prospective design comparing baseline psychiatric symptoms to screen time patterns one year later, with reciprocal analyses.",,MET,MET,,MET,"Published journal article (Social Psychiatry and Psychiatric Epidemiology, 2024), not a preprint or conference abstract","Journal article published in Social Psychiatry and Psychiatric Epidemiology (2024), not a preprint, conference abstract, or duplicate.",,False,False,,False,INCLUDE,,
18,10.1002/advs.202307540,"Causal Relationships Between Screen Use, Reading, and Brain Development in Early Adolescents.","Li, Mingyang",2024,"Advanced science (Weinheim, Baden-Wurttemberg, Germany)",1,INCLUDE,MET,UNKNOWN,MET,UNKNOWN,"U.S. ABCD Study, approximately 12,000 participants aged 9-13 years at baseline, 2-year follow-up (n=455 at 2-year follow-up from initial n=707)",Abstract mentions ABCD dataset but PDF not yet reviewed.,"Uses U.S. ABCD Study data: approximately 1200 participants aged 9-13 years at baseline, 2-year follow-up assessment",MET,UNKNOWN,MET,UNKNOWN,"Screen use types measured separately: TV watching (TVMs), Video (watching videos), Game (video games), Text (cell phone texting), SNS (social networking sites), VC (video chatting); also reading time. Platform-specific measurements extractable from analyses.",PDF not yet reviewed.,"Measures specific smartphone/social media variables separately: TV watching (TVM), Video, Game (video games), Text (cell phone texting), SNS (social networking sites), VC (video chatting). Platform-specific screen use coefficients are separately extractable from analyses reported in Tables and Figures",MET,UNKNOWN,MET,UNKNOWN,"Linear mixed-effects (LME) models and Mendelian randomization analyses reporting causal effects. Regression coefficients for screen use on cognitive/behavioral outcomes: TVM on picture vocabulary β=-2.39 (corrected p<0.02), TVM on withdrawn/depressed β=0.57 (corrected p<0.05), VC on behavioral problems β=-0.30 (corrected p<0.0006)",PDF not yet reviewed.,"Linear mixed-effects (LME) models and Mendelian randomization analyses with inferential statistical tests. Reported causal effect coefficients for screen use predicting cognitive and behavioral outcomes: TVM on picture vocabulary β=-2.39 (corrected p<0.02), TVM on withdrawn/depressed β=0.57 (corrected p<0.05), VC on behavioral problems β=-0.30 (corrected p<0.0006)",MET,UNKNOWN,MET,UNKNOWN,"Multiple effect coefficients with p-values reported: β=-2.39 (corrected p<0.02), β=0.57 (corrected p<0.05), β=-0.30 (corrected p<0.0006), and numerous Mendelian randomization coefficients in Table S2 with credible intervals",PDF not yet reviewed.,"Multiple β coefficients reported with p-values and credible intervals: β=-2.39 (corrected p<0.02), β=0.57 (corrected p<0.05), β=-0.30 (corrected p<0.0006), and numerous Mendelian randomization coefficients in Table 2 and supplementary materials with 95% credible intervals",MET,UNKNOWN,MET,UNKNOWN,"Original longitudinal empirical analysis using ABCD data with causal inference methods (LME models, genetic instrumental variables, Mendelian randomization, two-sample MR analysis)",PDF not yet reviewed.,"Original empirical longitudinal analysis using ABCD Study data with causal inference methods: LME models, genetic instrumental variables, Mendelian randomization (forward and reverse), and mediation analysis examining prospective associations over 2-year follow-up",MET,UNKNOWN,MET,UNKNOWN,"Published journal article (Advanced Science, 2024), not a preprint or duplicate",PDF not yet reviewed.,"Published journal article in Advanced Science (2024), not a preprint or duplicate",False,,False,False,UNSURE,,
442,10.1556/2006.2024.00068,The longitudinal association between reward processing and symptoms of video game addiction in the Adolescent Brain Cognitive Development Study.,"Lopez, Daniel A",2024,Journal of behavioral addictions,1,INCLUDE,MET,UNKNOWN,MET,UNKNOWN,"U.S. ABCD Study, years 2-4 data, N=6,143 adolescents (mean age year-2=12 years), longitudinal follow-up design",Abstract mentions ABCD Study but PDF not yet reviewed.,"ABCD Study data from years 2-4, N=6,143 adolescents with observations=12,745, mean age at year-2=12 years",NOT_MET,UNKNOWN,NOT_MET,UNKNOWN,Paper measures video game addiction (VGAQ outcome) with reward processing (neural fMRI activation in caudate) as predictor. Video games are explicitly listed under NOT QUALIFYING exposures (E17: 'Console or PC video games' excluded). No smartphone or social media variable measured. Gaming addiction questionnaire is not a qualifying SM/phone exposure per criteria.,PDF not yet reviewed.,Paper measures 'Video Game Addiction Questionnaire (VGAQ)' as primary outcome. Predictor is reward processing (neural fMRI activation in caudate during Monetary Incentive Delay task). Video games explicitly listed under NOT QUALIFYING exposures per criteria: 'Console or PC video games' excluded. E17 states 'Video games unspecified platform → NOT_MET'. No smartphone or social media variables measured in this analysis.,NOT_MET,UNKNOWN,NOT_MET,UNKNOWN,Fails FT_IC2; exposure (reward processing neural activation) is neither smartphone nor social media,PDF not yet reviewed.,Fails due to FT_IC2 failure. Exposure (reward processing neural activation) is neither smartphone nor social media.,NOT_MET,UNKNOWN,NOT_MET,UNKNOWN,Fails FT_IC2,PDF not yet reviewed.,Fails due to FT_IC2 failure.,NOT_MET,UNKNOWN,NOT_MET,UNKNOWN,Fails FT_IC2,PDF not yet reviewed.,Fails due to FT_IC2 failure.,NOT_MET,UNKNOWN,NOT_MET,UNKNOWN,Fails FT_IC2,PDF not yet reviewed.,Fails due to FT_IC2 failure.,False,,False,False,UNSURE,,
192,10.1038/s41598-024-63566-y,Long-term impact of digital media on brain development in children,Samson Nivins,2024,Scientific Reports,1,INCLUDE,MET,MET,,MET,"Uses ABCD Study data release 5.0; 6,469 children from 21 research sites in US, aged 9-11 years at baseline, followed for 4 years","Uses ABCD Study data: 'a prospective, multicentre, longitudinal cohort of children from the Adolescent Brain and Cognitive Development Study, aged 9.9 years when entering the study'",,MET,MET,,MET,"Measures specific smartphone/social media variables: social media usage (hours/day), video game playing (hours/day), television/video watching (hours/day). Assessed via Youth Screen Time Survey.","Specific smartphone/SM variables measured: social media use, video game playing, watching television/videos via Youth Screen Time Survey; social media usage measured separately with hours/day estimates",,MET,MET,,MET,"Quadratic mixed effect modeling examining relationships between individual digital media usage and brain development outcomes (global cortical surface area, striatum, cerebellum volumes). Reported β coefficients and statistical significance (p < 0.003 after Bonferroni correction).","Inferential statistical tests linking SM/DM variables to non-SM outcomes (brain development): quadratic-mixed effect modeling testing relationships between individual DM usage (social media, video games, TV/videos) and brain structures (cortex, striatum, cerebellum)",,MET,MET,,MET,"Reports β coefficients for social media usage (linear: β = 0.02; quadratic: β = -0.02), p-values (p < 0.001), and confidence intervals in Table 2 and narrative results.","Multiple β coefficients reported: e.g., social media usage × time interaction with cerebellum 'β = 0.02'; social media usage × time² 'β = −0.02'; Table 2 contains extensive numeric results with β values and p-values",,MET,MET,,MET,"Original empirical longitudinal analysis; prospective, multicentre cohort study with quadratic mixed effect modelling over 4-year follow-up period with annual assessments.",Original empirical longitudinal analysis: 4-year follow-up study with annual measurements of DM usage and biennial brain MRI scans; quadratic-mixed effect modeling employed,,MET,MET,,MET,"Published journal article in Scientific Reports, 2024; not a preprint or duplicate.","Journal article published in Scientific Reports, 2024",,False,False,,False,INCLUDE,,
79,10.1016/j.acap.2023.11.019,The Association between Family Environment and Subsequent Risk of Cyberbullying Victimization in Adolescents.,"Shao, Iris Y",2024,Academic pediatrics,1,INCLUDE,MET,MET,,MET,"Uses ABCD Study data; 10,410 eligible participants with non-missing family environment and cyberbullying victimization data from Years 1 and 2.","Uses ABCD Study data: 'we used multivariable logistic regressions...in 10,410 eligible ABCD study participants' with baseline enrollment ages 9–10",,NOT_MET,NOT_MET,,NOT_MET,"Outcome is cyberbullying victimization; predictors are parental monitoring and family conflict (demographic/family factors). No smartphone or social media variable is separately measured or reported as the exposure. Per E6, cyberbullying alone without separately-measured phone/SM variable fails FT-IC2.","Outcome is cyberbullying victimization only; no specific smartphone or social media variable measured as exposure. Exposures are family environment (parental monitoring, family conflict) and sociodemographic factors. Cyberbullying alone without separately measured phone/SM variable does not qualify per E6.",,MET,MET,,MET,Multivariable logistic regression models assessing associations between parental monitoring/family conflict and cyberbullying victimization with reported odds ratios and confidence intervals.,"Multivariable logistic regression testing associations: parental monitoring → cyberbullying victimization (OR: 0.61, 95% CI: 0.50–0.75); family conflict → cyberbullying victimization (OR: 1.10, 95% CI: 1.04–1.16)",,MET,MET,,MET,Reports OR and 95% CI: parental monitoring OR = 0.61 (95% CI: 0.50-0.75); family conflict OR = 1.10 (95% CI: 1.04-1.16) in Tables 2-3.,"OR and 95% CI reported: 'OR: 0.61, 95% CI: 0.50–0.75' and 'OR: 1.10, 95% CI: 1.04–1.16'; secondary analyses include individual item OR estimates",,MET,MET,,MET,Original empirical longitudinal analysis; multivariable logistic regression with prospective design linking Year 1 predictors to Year 2 outcomes.,"Original empirical longitudinal analysis: family environment measured at Year 1, cyberbullying victimization measured at Year 2 follow-up",,MET,MET,,MET,"Published journal article in Academic Pediatrics, 2024; not a preprint or duplicate.","Journal article published in Academic Pediatrics, 2024",,True,False,,False,EXCLUDE,FT-EC2,FT_IC2
377,10.1177/00111287241305057,Traumatic Stress Exposure as a Predictor of Dual Systems Model Development: Examining Deviant Peer Association as a Social Mediating Mechanism,Thomas Wojciechowski,2024,Crime & Delinquency,1,INCLUDE,MET,MET,,MET,"Uses ABCD Study data; first five waves of ABCD study comprising 11,880 youth aged 9-10 at baseline across 21 US sites.",Uses ABCD Study data: 'The Adolescent Brain Cognitive Development data were analyzed' in analysis of traumatic stress exposure and dual systems model development,,NOT_MET,NOT_MET,,NOT_MET,"No smartphone or social media variables measured. Study focuses on traumatic stress exposure (measured via Kiddie Schedule for Affective Disorders), deviant peer association (Peer Behavior Profile), and dual systems model constructs (impulse control, sensation-seeking). No phone/SM exposure present.","No smartphone or social media variable measured. Exposures are traumatic stress exposure and deviant peer association; outcomes are impulse control and sensation-seeking (psychological constructs only, no non-SM outcome involving phone/SM). No SM/phone-specific variable present.",,MET,MET,,MET,Structural equation modeling with mediation pathways; reports direct and indirect effects of traumatic stress exposure on dual systems model outcomes through deviant peer association as mediator.,"Structural equation modeling (SEM) testing mediation: 'Deviant peer association significantly mediated the relationship between traumatic stress exposure and impulse control, accounting for about 25% of this relationship'",,MET,NOT_MET,,UNKNOWN,"Reports standardized path coefficients and statistical significance in narrative and results sections (e.g., deviant peer association accounted for about 25% of relationship between traumatic stress and impulse control).","No numeric coefficients, β values, OR, p-values, or statistics reported. Only narrative statement of mediation finding (e.g., 'accounted for about 25%') without specific statistical estimates or test values.",,MET,MET,,MET,Original empirical analysis; structural equation modeling with cross-sectional and longitudinal pathways examining mediation relationships.,Original empirical study using ABCD data with structural equation modeling to analyze direct and indirect effects across waves,,MET,MET,,MET,"Published journal article in Crime & Delinquency, 2024; not a preprint or duplicate.","Journal article published in Crime & Delinquency, 2024",,False,False,,False,EXCLUDE,FT-EC2,FT_IC2
403,10.1186/s13104-024-06777-w,Social epidemiology of online dating in U.S. early adolescents.,"Nagata, Jason M",2024,BMC research notes,1,INCLUDE,MET,MET,,MET,"Uses ABCD Study Year 2 (2018-2020), ages 11-12, N=10,157 cross-sectional data","Uses ABCD Study Year 2 (2018-2020), ages 11-12, N=10,157",,MET,MET,,MET,Online dating app use: 'Have you ever used a dating app?' (yes/no) — qualifies as online dating/hookup app variable,Online dating app use: 'Have you ever used a dating app?' Qualifies as online dating/hookup app exposure,,MET,MET,,MET,Multivariable logistic regression analyses testing associations between sociodemographic factors and online dating behavior,Multivariable logistic regression with sociodemographic predictors of online dating behavior,,MET,MET,,MET,AOR and 95% CI reported: Males AOR 2.72 (95% CI 1.11-6.78); Sexual minority AOR 12.97 (95% CI 4.32-38.96),Reports AOR 2.72 (95% CI 1.11-6.78) for male sex; AOR 12.97 (95% CI 4.32-38.96) for sexual minority status,,MET,MET,,MET,Original empirical cross-sectional analysis of ABCD Study data with logistic regression,Original cross-sectional empirical analysis of ABCD data with inferential statistics,,MET,MET,,MET,"Published journal article, BMC Research Notes 2024","Journal article (BMC Research Notes, 2024), no evidence of duplication",,False,False,,False,INCLUDE,,
291,10.1111/apa.17365,Problematic smartphone use: What can teenagers and parents do to reduce use?,Nicola J. Kalk,2024,Acta Paediatrica,1,INCLUDE,UNKNOWN,UNKNOWN,,UNKNOWN,References Carter et al. (2024) and ABCD study findings but does not clearly state original analysis of ABCD data by these authors,Commentary/opinion piece that cites ABCD study findings but does not conduct independent ABCD analyses,,MET,MET,,MET,"Discusses problematic smartphone use, notification strategies, social media use, specific apps (TikTok, Instagram, apps, video games), addiction patterns","Discusses problematic smartphone use, which qualifies as a smartphone/SM exposure variable",,NOT_MET,NOT_MET,,NOT_MET,This is a perspective/commentary article; no original inferential statistical tests reported by authors linking smartphone/SM variables to outcomes,No inferential statistical tests reported. This is narrative commentary and opinion only,,NOT_MET,NOT_MET,,NOT_MET,"No original numeric coefficients, beta values, or p-values reported by authors; references others' findings only","No numeric coefficients, test statistics, or p-values reported for statistical associations",,NOT_MET,NOT_MET,,NOT_MET,Perspective/commentary article with no original empirical analysis; review of existing literature and commentary on Carter et al. 2024,"Commentary/editorial/opinion piece citing Carter et al (2024), not original empirical analysis",,MET,MET,,MET,"Published journal article, Acta Paediatrica 2024","Journal article (Acta Paediatrica, 2024), appears to be original publication",,False,False,,False,EXCLUDE,FT-EC3,FT_IC5
196,10.1038/s44277-024-00006-9,Probing the digital exposome: associations of social media use patterns with youth mental health.,"Pagliaccio, David",2024,NPP - digital psychiatry and neuroscience,1,INCLUDE,MET,MET,,MET,"Uses ABCD Study 2-year follow-up assessed 2019-2020, N=10,147, mean age 12.0 years","Uses ABCD Study data from 2019-2020 follow-up, N=10,147, mean age 12.0 years",,MET,MET,,MET,"Multiple specific social media variables measured: type of apps used (TikTok, Instagram, Snapchat, YouTube, Facebook, Twitter, Reddit, Tumblr), time spent, secret accounts, problematic/addictive use patterns, cyberbullying, weekday/weekend use patterns, bedtime social media use","Multiple specific social media and smartphone variables: app use (TikTok, Instagram, Snapchat, YouTube, Twitter, Facebook, Tumblr), time spent, secret accounts, cyberbullying exposure, problematic/addictive use patterns, parental monitoring",,MET,MET,,MET,Linear mixed-effects models and logistic regression testing associations between 41 digital/social media exposures and BPM Total Problems T-scores (LME with FDR-correction); logistic regression with suicide attempts outcome,Linear mixed-effects models and logistic regression testing associations between digital exposures and BPM Total Problems T-scores and suicide attempt history,,MET,MET,,MET,"Coefficients, 95% CI, t-statistics, p-values reported: e.g., digital exposomic risk estimate=1.78 (95% CI [1.58-1.98], t=17.41, p<0.001); OR=1.76 (95% CI [1.39-2.23]) for suicide attempts","Reports coefficient estimate=1.78, 95% CI [1.58-1.98], t=17.41, p<0.001 for digital exposomic risk and BPM-T-scores; OR=1.76, 95% CI [1.39-2.23], p<0.001 for suicide attempts",,MET,MET,,MET,Original empirical cross-sectional analysis of ABCD Study; exposure-wide association study (ExWAS) with separate LME models for each of 41 digital exposures; validation in independent test subsample,Original empirical analysis using exposome-wide association study (ExWAS) methodology on ABCD data with split train/test samples,,MET,MET,,MET,"Published journal article, NPP - Digital Psychiatry and Neuroscience 2024","Journal article (NPP - Digital Psychiatry and Neuroscience, 2024), no evidence of prior publication",,False,False,,False,INCLUDE,,
