paper_id,title,authors,year,doi,has_pdf,FINAL_decision,FINAL_EC_code,FINAL_reason,FT_IC1_C1,FT_IC1_C2,FT_IC1_Resolver,FT_IC1_FINAL,FT_IC1_C1_evidence,FT_IC1_C2_evidence,FT_IC1_Resolver_rationale,FT_IC2_C1,FT_IC2_C2,FT_IC2_Resolver,FT_IC2_FINAL,FT_IC2_C1_evidence,FT_IC2_C2_evidence,FT_IC2_Resolver_rationale,FT_IC3_C1,FT_IC3_C2,FT_IC3_Resolver,FT_IC3_FINAL,FT_IC3_C1_evidence,FT_IC3_C2_evidence,FT_IC3_Resolver_rationale,FT_IC4_C1,FT_IC4_C2,FT_IC4_Resolver,FT_IC4_FINAL,FT_IC4_C1_evidence,FT_IC4_C2_evidence,FT_IC4_Resolver_rationale,FT_IC5_C1,FT_IC5_C2,FT_IC5_Resolver,FT_IC5_FINAL,FT_IC5_C1_evidence,FT_IC5_C2_evidence,FT_IC5_Resolver_rationale,FT_IC6_C1,FT_IC6_C2,FT_IC6_Resolver,FT_IC6_FINAL,FT_IC6_C1_evidence,FT_IC6_C2_evidence,FT_IC6_Resolver_rationale,FT_EC7_applies_C1,FT_EC7_applies_C2,FT_EC7_applies_Resolver,FT_EC7_applies_FINAL,FT_EC7_applies_C1_evidence,FT_EC7_applies_C2_evidence,FT_EC7_applies_Resolver_rationale
295,"Extracurricular Activities, Screen Media Activity, and Sleep May Be Modifiable Factors Related to Children's Cognitive Functioning: Evidence From the ABCD Study",,2021,10.1111/cdev.13578,True,INCLUDE,,all criteria MET; FT-EC7 not applicable,MET,MET,,MET,"ABCD Study, 9,718 school-age children from U.S., baseline data from 21 research sites","ABCD baseline sample, US cohort, 9-10 year-old children, 9,718 participants",,MET,MET,,MET,"Screen media activity (SMA) measured as hours per day on weekday and weekend, weighted average. Includes social network sites, texting, TV shows/movies, videos, video games, video chat. B1 applies: machine learning model reports feature importance for screen media activity as separate predictor alongside extracurricular involvement and sleep duration (Figure S5).",Screen media activity measured on weekday and weekend; separate continuous variables submitted to ML model as independent predictors. Applies B1 (separate coefficient for screen time variable in regression/ML framework).,,MET,MET,,MET,"Machine learning framework identifies variables associated with fluid cognitive functioning (FCF). Variables with highest importance determined via stacking ensemble methods and variable importance (VI) metrics computed across models (Figure 1, page 2044). Linear mixed effects (LME) models report F-statistics for associations between screen media activity and FCF.","Machine learning framework with regression-based variable importance and partial dependence analysis. Penalized regression coefficients reported (Table 2: r, pFDR, VI). Meets B8/B9 requirement for traditional regression coefficients in ML context.",,MET,MET,,MET,"F-statistics reported in Table 2 and Figure 2 for screen media activity (weekday: F(1,9,670)=27.86, p<.001; weekend: F(1,9,670)=-71.86, p<.001). Machine learning model R2=14.74% variance explained, 95% CI [14.53, 14.88]","Table 2 reports Spearman r, pFDR (p-value false discovery rate corrected), and variable importance (VI) with 95% confidence intervals for screen media activity coefficients.",,MET,MET,,MET,Original ABCD empirical analysis using machine learning framework to identify factors associated with fluid cognitive functioning,Original ABCD empirical analysis using machine learning to identify factors associated with fluid cognitive functioning. Screen media activity included as independent variable predicting cognitive outcome.,,MET,MET,,MET,"Published article in Child Development, not preprint/abstract duplicate","Original published study, not a preprint or duplicate.",,FALSE,FALSE,,FALSE,"Not applicable. Study examines screen media activity as IV predicting FCF (outcome), not SM as DV. Predictors include environmental, socioeconomic, and child-specific factors beyond demographics alone (e.g., extracurricular involvement, parental education, family conflict, trauma exposure, impulsivity).","Screen media activity is independent variable predicting cognition (outcome), not a dependent variable. Does not meet FT-EC7 condition (a)—SM is not the outcome in all analyses.",
302,Contemporary screen time usage among children 9-10-years-old is associated with higher body mass index percentile at 1-year follow-up: A prospective cohort study.,,2021,10.1111/ijpo.12827,True,INCLUDE,,all criteria MET; FT-EC7 not applicable,MET,MET,,MET,"U.S. ABCD Study (N=11,066), baseline 2016-2018 (ages 9-10), 1-year follow-up 2017-2019","US ABCD Study, N=11,066 children ages 9-10 at baseline, followed to 1-year follow-up. Prospective cohort from 21 US sites.",,MET,MET,,MET,"Multiple qualifying smartphone and social media variables: texting (B=0.92, 95% CI 0.29-1.55), video chat (B=0.72, 95% CI 0.09-1.36), video games (B=0.42, 95% CI 0.06-0.78), social networking. Applies B1—separate β reported for each SM modality.","Multiple qualifying smartphone/screen time variables: texting (phone), video chat (video chat on phone), video games (gaming), television/streaming videos. Separate β coefficients reported for each modality. Applies B1 (YSTS papers reporting separate β for SM, texting, video chat, mobile phone).",,MET,MET,,MET,Multiple linear regression analyses testing SM → BMI percentile outcome (Table 2). Each screen time variable examined in separate regression models with B coefficients and 95% CIs.,Multiple linear regression analyses examining associations between baseline screen time (exposure) and BMI percentile at 1-year follow-up (outcome). Table 2 reports β coefficients with 95% CIs and p-values for each screen time modality.,,MET,MET,,MET,"Beta coefficients and 95% CIs reported in Table 2 for all screen time modalities (total screen time B=0.22, texting B=0.92, video chat B=0.72, video games B=0.42, social networking B=0.67, all with p-values)","Numeric coefficients fully extractable. Table 2 reports B (β) coefficients with 95% CIs and p-values. Examples: total screen time B=0.22 (95% CI 0.10-0.34), texting B=0.92 (95% CI 0.29-1.55), video chat B=0.72 (95% CI 0.09-1.36), video games B=0.42 (95% CI 0.06-0.78).",,MET,MET,,MET,Original ABCD empirical analysis. Prospective cohort design with baseline screen time exposure and 1-year follow-up BMI percentile outcome.,Original empirical analysis using ABCD Study data. Multiple linear regression analyses conducted with prospective design examining associations between baseline screen time and BMI percentile at follow-up.,,MET,MET,,MET,"Original published paper, no duplicate detected.","Published journal article (Pediatric Obesity, 2021) with clear DOI. No indication of duplication with preprint, abstract, or deposit version.",,FALSE,FALSE,,FALSE,B18 carve-out applies. Screen time (smartphone/SM) is the independent variable (IV) predicting a non-SM outcome (BMI percentile). FT-EC7 requires SM as dependent variable with only demographic predictors. Here SM is IV → outcome.,"Fails condition (a): Smartphone/SM is NOT the dependent variable. BMI percentile is the outcome; screen time is the predictor. This is a screen-time-as-IV analysis, not demographics-to-SM analysis. EC7 does not apply.",
303,Multiâlevel predictors of depression symptoms in the Adolescent Brain Cognitive Development (ABCD) study,,,10.1111/jcpp.13608,False,NA_FOR_NOW,,at least one criterion UNKNOWN with no PDF,UNKNOWN,MET,MET,MET,"Title mentions ABCD study but no PDF available to confirm full dataset details, sample size, or release version.",ABCD study (referenced in abstract and methods),"Per FT-IC1 (Population criterion): 'Paper analyzes data from the U.S. ABCD Study' = MET. The title and available abstract snippet unambiguously identify this as an ABCD study analysis. Although no PDF is available, the title is explicit and sufficient to confirm ABCD cohort. No NA_FOR_NOW or UNKNOWN classification is warranted when the title explicitly names ABCD. C2 is correct.",UNKNOWN,UNKNOWN,,UNKNOWN,"Abstract mentions 'screen time' but lacks detail. Unable to determine from abstract alone whether screen time includes qualifying SM/smartphone variables (platform-specific, SM accounts, texting, video chat) or is unspecified 'screen time' (B5 NOT_MET category). Requires full PDF.",No PDF available. Abstract mentions 'screen time' as predictor of depression symptoms but does not specify whether it includes qualifying SM variables or only TV/gaming. Cannot determine if separate SM coefficient exists.,,UNKNOWN,UNKNOWN,,UNKNOWN,Abstract mentions screen time in context of depression outcomes but no test type or citation provided without full text.,Not evaluable without PDF; presumed regression analysis based on abstract,,UNKNOWN,UNKNOWN,,UNKNOWN,No PDF available; cannot extract numeric data from tables or supplement.,Not evaluable without PDF,,UNKNOWN,UNKNOWN,,UNKNOWN,Title and abstract indicate ABCD analysis but full study design cannot be verified without PDF.,Not evaluable without PDF,,UNKNOWN,UNKNOWN,,UNKNOWN,No PDF to assess for duplicate status.,Not evaluable without PDF,,FALSE,FALSE,,FALSE,Cannot determine EC7 status without full PDF content. Presumed NOT_APPLY pending review.,Cannot determine without full PDF access,
304,Contemporary screen time modalities and disruptive behavior disorders in children: a prospective cohort study.,,2023,10.1111/jcpp.13673,True,INCLUDE,,all criteria MET; FT-EC7 not applicable,MET,MET,,MET,"US ABCD Study, N=11,875 (analysis sample after exclusions), children 9-11 years old at baseline (2016-2018), 1-year follow-up (2017-2019)","ABCD Study (N=11,875), baseline ages 9-11 years. Nagata et al. 2023 prospective cohort study.",,MET,MET,,MET,"Multiple qualifying smartphone/SM variables: total screen time, television/movies, videos, video games, social media, video chat, texting. Each reported as separate modality with own coefficient. Applies B1 (separate β/PR for SM, texting, video chat, video games reported with own coefficients; conduct disorder strongest for social media at PR 1.62, 95% CI 1.39-1.87).","Screen time modalities: total screen time, television/movies, video games, social media, video chat, texting. All qualify as smartphone/video/social media use (B1: separate coefficients for multiple modalities reported).",,MET,MET,,MET,"Modified Poisson regression: PR 1.07 (95% CI 1.03-1.11) for total screen time and conduct disorder; PR 1.62 (95% CI 1.39-1.87) for social media and conduct disorder; PR 1.21, 1.19, 1.17, 1.14 for video chat, texting, TV/movies, video games respectively predicting oppositional defiant disorder",Modified Poisson regression analyses. Prevalence ratios (PR) with 95% CI reported for each modality predicting conduct disorder or oppositional defiant disorder at 1-year follow-up.,,MET,MET,,MET,Results section reports prevalence ratios (PR) with 95% confidence intervals for all screen modalities predicting conduct and oppositional defiant disorder,Numeric coefficients in text and tables: PR values with 95% CI. Example: social media PR 1.62 (95% CI 1.39-1.87) for conduct disorder; video games PR 1.14 (95% CI 1.07-1.21) for oppositional defiant disorder.,,MET,MET,,MET,Original ABCD prospective cohort analysis: baseline screen time (age 9-11) predicting parent-reported conduct/oppositional defiant disorder at 1-year follow-up based on KSADS-5,Original ABCD prospective empirical analysis with screen time variables predicting disruptive behavior disorder diagnoses (KSADS-5).,,MET,MET,,MET,Published peer-reviewed article in Journal of Child Psychology and Psychiatry (2023); no evidence of duplicate,"Published article (Journal of Child Psychology and Psychiatry 2023, 64(1):125-135), no evidence of duplicate.",,FALSE,FALSE,,FALSE,"Screen time is independent variable (IV) predicting disruptive behavior disorders (conduct disorder, oppositional defiant disorder) as dependent variables (DV), not SM as DV. FT-EC7 requires SM as DV with only demographic predictors. Does not apply per condition (a) violation.","Screen time/social media is the INDEPENDENT variable, not dependent variable. Outcomes are conduct disorder and oppositional defiant disorder diagnoses. Fails condition (a) of FT-EC7 binding rule.",
305,"Sexual and gender minority identity, peer victimization, and suicidality in adolescents: AÂ mediation study using the ABCD Study.",,2025,10.1111/jcpp.14155,False,INCLUDE,,all criteria MET; FT-EC7 not applicable,MET,MET,,MET,"U.S. ABCD Study. 5,596 youth, 47.2% female, 55.5% non-Hispanic White, ages 9-10 at waves 1-2, 11-12 at wave 3.","US ABCD Study (Adolescent Brain Cognitive Development Study), first three waves, baseline 5596 participants ages 9-10 years, across multiple sites",,MET,MET,,MET,"Cyber victimization (cyberbullying component of online victimization). Per B4: cyberbullying separately measured as 'cyber victimization' with own coefficient in mixed-effects logistic regression, not cyberbullying alone.",Cyberbullying combined with peer and cyber victimization as dual predictors of suicidality. Cyber victimization qualifies as online victimization measure. Applies B4 (cyberbullying + separately measured SM/online construct with own coefficients).,,MET,MET,,MET,"Mixed-effects logistic regression. Direct associations reported: SGM → suicidality (OR 4.75-5.87, 95% CIs); peer/cyber victimization → suicidality. Longitudinal mediation analysis quantifying indirect pathways.",Mixed-effects logistic regression for SGM identity → suicidal ideation/attempts (ORs reported); longitudinal mediation analysis quantifying peer and cyber victimization as mediators,,MET,MET,,MET,"Odds ratios extracted: SGM→ideation (OR 4.75, 95% CI 3.74-6.03); SGM→attempts (OR 5.87, 95% CI 3.72-9.28); cyber victimization (OR 2.35, 95% CI 1.77-3.11); mediation 22%-28%.",Multiple numeric values in main text: OR 4.75 (95% CI 3.74-6.03) for lifetime SI; OR 5.87 (95% CI 3.72-9.28) for lifetime SA; OR 4.94 (95% CI 3.19-7.68) for current SI/SA; peer victimization ORs with 95% CIs; cyber victimization OR 2.35 (95% CI 1.77-3.11); mediation proportions 22%-28%,,MET,MET,,MET,"Original ABCD prospective cohort analysis examining longitudinal associations between sexual/gender minority identity and suicidal outcomes, with victimization as mediators.",Original empirical analysis of ABCD data with novel mediation pathways linking SGM identity to suicidality via peer and cyber victimization,,MET,MET,,MET,Published 2025 in Journal of Child Psychology and Psychiatry. No evidence of preprint or duplicate.,No evidence of preprint/duplicate; published 2025 in Journal of Child Psychology and Psychiatry,,FALSE,FALSE,,FALSE,"Cyber victimization (SM-adjacent) is mediator between SGM identity (demographic/identity predictor) and suicidality (non-SM outcome). Identity variables (sexual orientation, gender identity) per B17 explicitly disqualify FT-EC7. FT-EC7 requires demographic-only predictors; gender identity/sexual orientation are identity constructs exceeding closed demographic set.","Cyber victimization is an IV (mediator) predicting suicidal ideation/attempts (outcomes), not a DV. Additionally, SGM identity is predictor of both victimization and outcomes, but this is not a demographic-only → SM analysis. Therefore FT-EC7 does not apply.",
306,Trajectories of psychotic-like experiences in youth and associations with lifestyle factors.,,2026,10.1111/jcpp.14179,False,EXCLUDE,FT-EC2,FT_IC2 = NOT_MET,MET,MET,,MET,"ABCD Study, N=10,075, ages 9–10 at baseline. Abstract explicitly states 'Adolescent Brain Cognitive Development Study (N=10,075, age 9-10 years at baseline)'.","US ABCD Study, N=10,075, age 9-10 years at baseline",,NOT_MET,MET,NOT_MET,NOT_MET,"Abstract mentions 'baseline lifestyle behaviors (including self-reported screen time, physical activity and caffeine intake...)' and results show 'individuals in the Persistent Elevated Distress trajectory spent more time using screens (adjusted Odds Ratio [OR] 2.27, 95% confidence interval [CI] 2.03-2.53)'. Screen time is unspecified-platform generic measure. Per B5 (unspecified-platform 'internet use' without device specification → NOT_MET) and B7 ('reading-on-screens, e-mail' and generic screen time without SM/smartphone breakdown → NOT_MET). No mention of smartphone ownership, app use, social media, or texting as qualifying exposures.","Self-reported screen time (qualifying smartphone/screen variable per B5: time on phone/screen time is qualifying exposure). Also includes physical activity, caffeine, sleep - but screen time is the qualifying exposure.","B5 and B7 specify that generic 'screen time' without device/platform specification or per-modality breakdown does NOT qualify. No smartphone ownership, app use, social media, texting, or video chat measured separately. This is total/unspecified screen time only → FT_IC2 NOT_MET.",MET,MET,,MET,"Multinomial logistic regressions examining associations between baseline lifestyle behaviors and psychotic-like experience (PLE) trajectories. ORs and 95% CIs reported in abstract: 'Compared with the No Distress trajectory, individuals in the Persistent Elevated Distress trajectory...had odds of reporting...'","Multinomial logistic regression: adjusted Odds Ratios with 95% CI reported (e.g., screen time OR 2.27, 95% CI 2.03-2.53 vs No Distress trajectory). Citation: abstract states 'multinomial logistic regressions to examine associations between baseline lifestyle behaviors...and PLE trajectories.'",,MET,MET,,MET,"Numeric extractable: ORs with 95% CIs reported in abstract (e.g., OR 2.27, 95% CI 2.03–2.53 for screen time; OR 1.62, 95% CI 1.28–2.04 for caffeine). Statistical tests and measures reported.","Numeric extractable: OR, 95% CI, and p-values reported in abstract. Example: screen time OR 2.27 (95% CI 2.03-2.53); all key results include numeric coefficients.",,MET,MET,,MET,Original empirical analysis. ABCD Study latent growth mixture modeling of PLE trajectories and multinomial logistic regression testing lifestyle factor associations with trajectories.,Original empirical analysis: ABCD baseline data with original latent growth mixture models and multinomial logistic regressions examining screen time ↔ PLE trajectories.,,MET,MET,,MET,"Non-duplicate. Published in Journal of Child Psychology and Psychiatry 2026, DOI 10.1111/jcpp.14179, full research article.","No indication of duplicate; published 2026, Journal of child psychology and psychiatry.",,FALSE,FALSE,,FALSE,FT-EC7 does NOT apply. Psychotic-like experiences (PLE) are the outcome variable; lifestyle factors including screen time are predictors. Screen time is the independent variable (not SM/smartphone-as-DV). Paper structure is opposite of FT-EC7 binding condition.,"Screen time/lifestyle is the INDEPENDENT variable predicting PLE trajectories (outcome), not the DEPENDENT variable. FT-EC7 requires SM/smartphone as the DV with only demographic predictors. This paper has SM/screen time as IV → outcome (PLE). Does not meet criterion (a).",
309,Bidirectional associations of problematic social media use and problematic gaming with mental health difficulties and strengths in adolescents: Sex and social support â¦,,,10.1111/jora.70076,True,EXCLUDE,FT-EC1,FT_IC1 = NOT_MET,NOT_MET,UNKNOWN,NOT_MET,NOT_MET,"Amsterdam Born Children and their Development (ABCD) cohort study from the Netherlands, not the US ABCD Study. Explicitly stated: 'This longitudinal study started in 2003-2004 when pregnant women living in Amsterdam were invited to participate in the cohort study'",Abstract mentions 'ABCD study' and 'ABCD-youth' but does not explicitly confirm US ABCD Study or clarify if this is using ABCD data vs. citation only. Requires full text confirmation.,C1 correctly identified this as the Dutch ABCD cohort. The 2L-criteria FT-IC1 rule explicitly lists 'Amsterdam Born Children and their Development (Dutch ABCD)' as a NOT_MET case (FT-EC1). This is not the U.S. ABCD Study; it is a distinct Dutch longitudinal cohort. Resolver agrees with C1.,MET,MET,,MET,"Problematic social media use (PSMU) measured with Social Media Disorder Scale (Van Den Eijnden et al., 2016). Internet Gaming Disorder measured with Internet Gaming Disorder Scale. Both are qualifying variables",Problematic social media use and problematic gaming measured. Qualifying SM variable present. B6 likely applies: 'Mobile/app gaming or gaming + SM with separate coefficients → MET',,MET,MET,,MET,"Cross-lagged panel model (CLPM) examining temporal associations between PSMU, gaming, and mental health outcomes. Longitudinal mediation and moderation analyses; directional relationships tested",Bidirectional associations tested; likely mixed-effects or structural equation modeling implied by title reference to 'associations',,MET,UNKNOWN,,UNKNOWN,"Cross-lagged panel model coefficients reported. Standardized estimates provided (e.g., alpha measures of SMDS, IGDS scales; regression coefficients from CLPM). Path analysis with statistical significance testing","PDF available but abstract only provided in batch. Full text required to extract numeric values (beta, OR, correlation coefficients)",,MET,UNKNOWN,,UNKNOWN,Original empirical longitudinal analysis from ABCD (Amsterdam) cohort with two time points (T1: 2019-2020; T2: 2021),Abstract suggests empirical analysis but unclear if original ABCD analysis or secondary analysis of existing data without new coefficients,,MET,UNKNOWN,,UNKNOWN,"Published empirical article (Journal of Research on Adolescence, 2025); no evidence of preprint/abstract/duplicate",No duplicate markers evident but insufficient information in abstract,,FALSE,FALSE,,FALSE,"Bidirectional/cross-lagged model (B20): The paper examines bidirectional associations between PSMU and problematic gaming with mental health difficulties and strengths. This violates EC7 requirement (b) that SM must be DV only, and would trigger B20 carve-out",FT-EC7 does not apply. Title indicates bidirectional associations (B20): SM ↔ mental health. Bidirectional/cross-lagged models disqualify FT-EC7 per binding rule B20: 'If bidirectional / cross-lagged (B20): FT-EC7 does NOT apply.',
310,Associations between social media and crystallized and fluid performance trajectories in early adolescence.,,2025,10.1111/jora.70125,True,INCLUDE,,all criteria MET; FT-EC7 not applicable,MET,MET,,MET,"ABCD Study, Baseline N ≈ 12,000 (M age = 9.9; White = 52.0%, Hispanic = 20.3%, Black = 15.0%, Asian = 2.1%, Other = 10.5%; Female = 47.8%), tracked across 4 years","ABCD Study, Baseline N~12,000, age M=9.9; representative US sample (White=52.0%, Hispanic=20.3%, Black=15.0%, Asian=2.1%, Other=10.5%).",,MET,MET,,MET,Social media use as primary exposure; time-varying predictor of cognitive performance trajectories; meets B1 criterion for separate coefficient,Qualifying social media variable: time on social media (measured across 4 years). Applies B1 (SM measured with separate coefficient in growth models).,,MET,MET,,MET,"Parallel process latent growth curve modeling; trajectory coupling examined via covariances between social media growth and cognitive ability growth factors (crystallized abilities, inhibitory control/attention, processing speed)","Parallel process latent growth curve models testing association between social media use trajectory and cognitive performance trajectories (crystallized abilities, inhibitory control/attention, processing speed). Path coefficients estimated.",,MET,MET,,MET,Latent growth curve coefficients including trajectory coupling estimates; model parameter estimates for growth factors and their correlations reported,"Regression coefficients and model fit statistics reported in tables (Table 1: univariate growth models with β, SE, p-values; Table 2: bivariate correlations). Model fit indices: CFI, TLI, SRMR, RMSEA.",,MET,MET,,MET,Original ABCD empirical analysis; longitudinal parallel-process modeling of coupled trajectories across 4 years of early adolescence,Original empirical analysis using ABCD longitudinal data over 4 years examining social media use ↔ cognitive performance trajectory coupling.,,MET,MET,,MET,No detected duplicate publication,Published in Journal of Research on Adolescence (2025); no evidence of preprint/abstract duplicate.,,FALSE,FALSE,,FALSE,"Social media use is the INDEPENDENT variable in analyses predicting cognitive performance trajectories, not the dependent variable. Paper has SM → non-SM-outcome analysis (SM growth → cognitive ability growth coupling), disqualifying EC7 per § 3.1(a). EC7 requires SM as sole dependent variable across all analyses; this paper uses SM as IV alongside cognitive outcomes as DVs.","Social media is the IV (predicting cognitive performance trajectories), not the DV. Analysis examines SM ↔ non-SM-outcome (cognitive abilities). FT-EC7 does not apply because SM is not modeled as a dependent variable predicted by demographics alone.",
