paper_id,title,authors,year,doi,has_pdf,FINAL_decision,FINAL_EC_code,FINAL_reason,FT_IC1_C1,FT_IC1_C2,FT_IC1_Resolver,FT_IC1_FINAL,FT_IC1_C1_evidence,FT_IC1_C2_evidence,FT_IC1_Resolver_rationale,FT_IC2_C1,FT_IC2_C2,FT_IC2_Resolver,FT_IC2_FINAL,FT_IC2_C1_evidence,FT_IC2_C2_evidence,FT_IC2_Resolver_rationale,FT_IC3_C1,FT_IC3_C2,FT_IC3_Resolver,FT_IC3_FINAL,FT_IC3_C1_evidence,FT_IC3_C2_evidence,FT_IC3_Resolver_rationale,FT_IC4_C1,FT_IC4_C2,FT_IC4_Resolver,FT_IC4_FINAL,FT_IC4_C1_evidence,FT_IC4_C2_evidence,FT_IC4_Resolver_rationale,FT_IC5_C1,FT_IC5_C2,FT_IC5_Resolver,FT_IC5_FINAL,FT_IC5_C1_evidence,FT_IC5_C2_evidence,FT_IC5_Resolver_rationale,FT_IC6_C1,FT_IC6_C2,FT_IC6_Resolver,FT_IC6_FINAL,FT_IC6_C1_evidence,FT_IC6_C2_evidence,FT_IC6_Resolver_rationale,FT_EC7_applies_C1,FT_EC7_applies_C2,FT_EC7_applies_Resolver,FT_EC7_applies_FINAL,FT_EC7_applies_C1_evidence,FT_EC7_applies_C2_evidence,FT_EC7_applies_Resolver_rationale
98,"Current, future and potential use of mobile and wearable technologies and social media data in the ABCD study to increase understanding of contributors to child health.",,2018,10.1016/j.dcn.2018.03.008,True,EXCLUDE,FT-EC2,FT_IC2 = NOT_MET,MET,MET,,MET,U.S. Adolescent Brain Cognitive Development (ABCD) Study. Explicitly mentions ABCD study examining effects on 'childhood and adolescent neurodevelopment and psychosocial and health outcomes.' Meets population criterion.,Adolescent Brain Cognitive Development (ABCD) Study explicitly mentioned as the context for discussion of mobile and wearable technologies and social media data collection methods.,,NOT_MET,MET,NOT_MET,NOT_MET,"Resource/technology review paper, not empirical measurement paper. Discusses mobile and wearable technologies and social media data but does NOT report any primary measurements or uses of qualifying SM/smartphone variables in original ABCD data analysis. Paper outlines 'current, future and potential use' of technologies; no extractable SM exposure variables from ABCD data analyzed here. Per FT-IC5 binding (B14), resource/data papers are excluded as NOT empirical analysis.","Mobile phone use, smartphone technologies, wearable devices (accelerometers, Fitbit), social media data, and passive sensing methods discussed as current/future data collection approaches in ABCD.","B14 identifies resource/technology description papers as non-empirical. Paper outlines 'potential' approaches (iPads, Fitbit, wearable sensors, geolocation, biosensors, social media platforms) but does not report any original SM/smartphone exposure measurement or analysis in ABCD data. This is a review/resource description (FT-EC3), not a measurement paper. C1 correct; C2 misread discussion of technologies as equivalent to primary measurement.",NOT_MET,NOT_MET,,NOT_MET,"No inferential tests reported. Paper is descriptive/prospective only, discussing future potential of mobile/wearable technologies and social media in ABCD study design. No regression, SEM, correlation, or hypothesis tests on SM ↔ outcome relationships.",This is a methods/perspective paper describing technologies and measurement approaches; no original inferential tests of SM ↔ non-SM relationships reported. References to other studies' findings but no novel statistical tests in this paper.,,NOT_MET,NOT_MET,,NOT_MET,"No numeric coefficients, effect sizes, or statistical results reported. Descriptive review article only.","No numeric extractable coefficients, effect sizes, p-values, or test statistics reported from original analyses. Paper is descriptive/narrative in structure.",,NOT_MET,NOT_MET,,NOT_MET,NOT original empirical analysis. Paper is a resource/perspective article (B14) describing current and potential incorporation of mobile/wearable technologies and social media methods into ABCD study infrastructure. No original data analysis. Pure methods/perspective paper.,Resource/methods paper (B14). Discusses potential use of mobile and wearable technologies and social media data within ABCD but does not report original empirical analysis. Sections 1.1-1.3 describe current/future technologies; no SM↔outcome empirical analysis conducted by authors.,,MET,MET,,MET,No evidence of preprint/abstract/deposit duplicate.,Published primary journal article; no evidence of duplicate.,,FALSE,FALSE,,FALSE,"FT-IC5 NOT_MET (resource/perspective paper, not empirical). FT-EC7 evaluation not applicable. Paper does not report any SM/demographic longitudinal analyses.",Paper fails FT_IC5 (not original empirical analysis); EC7 evaluation moot. Excluded at inclusion criterion level.,
100,Youth screen use in the ABCDÂ® study.,,2022,10.1016/j.dcn.2022.101150,True,INCLUDE,,all criteria MET; FT-EC7 not applicable,MET,MET,,MET,"US ABCD study, 11,878 participants baseline, 12,000 children at baseline ages 9-10","US ABCD Study cohort; baseline 9-10 years, followed longitudinally",,MET,NOT_MET,MET,MET,Social media (SMAQ—6-item Bergen Social Media Addiction Scale adapted Year 2); Video gaming (VGAQ—8-item Bergen Video Game Addiction Questionnaire Year 2); time on social media; online social activity; video gaming time. Qualifies under B1 (YSTS with separate SM/gaming coefficients) and B6 (gaming + SM with separate coefficients),"B12: Pure measurement paper with psychometric analyses (SMAQ/VGAQ factor structure, invariance testing across demographics). Descriptive statistics only (means, comparisons by sex/race). No SM or smartphone as IV with coefficient predicting external outcome.","B1 applies: Paper reports separate estimates (p-values, means, t/χ²) for qualifying SM items (social media time, SMAQ). B6 also applies: Gaming is measured alongside SM with separate coefficients. Both rules → FT_IC2 MET. C2 incorrectly applied B12 (measurement-only); but the paper does report SM as predictor/IV in analyses testing associations with demographic outcomes.",MET,NOT_MET,MET,MET,"T-tests comparing sex differences (p < .001 for girls higher SMAQ, boys higher VGAQ); chi-squared tests; ANOVA; CFA/factor analysis (χ2 tests for invariance across sex/race); linear mixed-effects models; descriptive statistics with p-values","B12: Only SM-vs-SM concordance (factor invariance testing, SMAQ/VGAQ equivalence across groups). No inferential test of SM ↔ non-SM-outcome relationship.","Per criteria §2.6.1, qualifying inferential tests include t-test, chi-square, regression coefficient, mixed-effects model. Paper reports all of these linking SM variables (SMAQ, VGAQ, screen time) to non-SM variables (sex, race/ethnicity, age). C1 correct; C2 incorrectly claimed only 'SM-vs-SM concordance' (factor invariance) was tested, missing the between-groups comparisons of SM across demographics.",MET,NOT_MET,MET,MET,"Tables 1, 4, 5 report χ2 values, p-values, RMSEA, CFI, SRMR; Figures 1–3 show proportions with 95% CIs; t-values and p-values reported throughout (p < .001 for multiple comparisons)","No extractable numeric SM ↔ outcome coefficient. Chi-square and p-values reported for factor structure comparisons, but these test measurement invariance, not SM predicting behavioral/health outcomes.","B8 specifies that any traditional regression coefficient OR inferential test numeric value (t, χ², p, RMSEA, CFI, F) qualifies. Paper reports all of these. C1 correct; C2 mistakenly conflated factor-structure test statistics with 'no extractable numeric SM↔outcome coefficient,' ignoring that p-values, t-values, and fit indices ARE numeric values per the criteria.",MET,NOT_MET,MET,MET,"Original empirical analysis of ABCD study. Measurement paper demonstrating screen usage questionnaire development, longitudinal changes baseline–Year 2, and psychometric analyses of SMAQ/VGAQ","B13: Pure measurement/concordance paper. Adapted SMAQ and VGAQ scales, demonstrated psychometric properties across populations. No original SM → outcome analysis. Not eligible under B13 (would require at least one SM ↔ non-SM coefficient).","B13 states: 'Measurement paper...that ALSO reports at least one SM↔non-SM coefficient' → FT_IC5 MET. This paper validates SMAQ/VGAQ scales AND reports SM associations with demographics (sex differences in SMAQ/VGAQ scores, race differences in screen time). Per §2.5 borderline rule, measurement papers with criterion validity (SM↔outcome) qualify. C1 correct; C2 applied B12 (measurement-only with zero external outcome) incorrectly, missing the demographic outcome associations.",MET,MET,,MET,"Not identified as preprint, abstract, or duplicate. Published in Developmental Cognitive Neuroscience, 2022",Original empirical measurement study; no evidence of duplicate.,,TRUE,FALSE,FALSE,FALSE,"Smartphone/SM is the DEPENDENT variable in all analyses: time on SM, SMAQ, video gaming time, VGAQ are outcomes. Predictors are exclusively demographics: sex, race/ethnicity, age (per Table 1, Methods). All analyses are longitudinal/prospective (baseline to Year 1 to Year 2). Paper has NO SM↔non-SM outcome analysis. Satisfies FT-EC7 binding conditions (a), (b), (c) with no cross-sectional demographic-SM carve-out.",Paper fails FT_IC2 and FT_IC5 (measurement-only); EC7 logic does not apply.,"B15 explicitly states: 'Paper has any cross-sectional analysis where SM is DV and demographics are predictors' → FT-EC7 does NOT apply. This paper includes both cross-sectional (Year 2 baseline comparisons) and longitudinal (Year 1, Year 2 follow-ups) analyses of SM outcomes by demographics. The cross-sectional carve-out in B15 disqualifies the EC7 exclusion. C1 misidentified whether longitudinal-only vs. mixed designs apply; B15 resolves this by negating EC7 entirely when any cross-sectional SM-as-DV analysis exists."
101,Negative impact of daily screen use on inhibitory control network in preadolescence: A two-year follow-up study.,,2023,10.1016/j.dcn.2023.101218,True,INCLUDE,,all criteria MET; FT-EC7 not applicable,MET,MET,,MET,"Study analyzed neuropsychological data from 8,324 children (9-11 years old) from the ABCD Study. Two waves examined: baseline (09/2016–10/2018, N=8324) and year 2 follow-up (07/2018–01/2020, N=3891). U.S.-based ABCD Study sample, ages 108–131 months at baseline (M=119.28).","Analyzes 8,324 children (9-11 years) from ABCD Study baseline and year 2 follow-up (2016-2018 baseline, 2018-2020 year 2)",,MET,MET,,MET,"Screen-Activity Proportion (SAP) score used as primary measure: computed as DailyScreenTime / (DailyScreenTime + DailyActivityTime), reflecting relative daily screen exposure. Screen time measured via child self-report questionnaire with 12 items on different screen utilization types: TV shows/movies, watching videos, playing video games, texting, video chatting, social media. Measured separately for weekday and weekend. Applies B1 (separate measurement of multiple screen types as components).",Qualifying smartphone: 'daily screen time' measured as Screen-Activity Proportion (SAP). B1 applies: reporting separate screen time exposure (qualified as smartphone variable) with distinct coefficient in models predicting inhibitory control network,,MET,MET,,MET,"Correlation analysis (Pearson/Spearman with bootstrap CI) examining association between SAP and fronto-striatal connectivity at baseline and year 2. Mediation analysis (bootstrapping) tested whether SAP mediates relationship between BAS (reward sensitivity) and fronto-striatal connectivity. Group-level comparisons (independent t-tests) between high SAP and low SAP groups. Cite: Results section (baseline r = −0.040, 95% CI [−0.0605, −0.0186], BF10 = 13.10; year 2 r = −0.0933, BF10 = 428995.74). Mediation: indirect effect B = −6.920e-5, p < 0.001, 95% CI [−1.006e-4, −4.303e-5], explaining 27.27% of total effect.","Correlation analysis (Pearson r with bootstrap 50,000 resampling); mediation analysis (bootstrapping); Bayesian posterior inference; group-level t-tests comparing high vs low SAP groups",,MET,MET,,MET,"Correlation coefficients (r) with 95% bootstrap CI reported for both baseline (Fig. 1B: r = −0.040) and year 2 (Fig. 1C: r = −0.0933). Group comparisons report M (means) with t-statistics and Cohen's d: baseline high vs. low SAP (Mhigh = 0.021, Mlow = 0.027, t(1571) = 3.043, p = 0.002, d = 0.153); year 2 (Mhigh = 0.010, Mlow = 0.024, t(709) = 5.675, p < 0.001, d = 0.427). Mediation analysis reports indirect effect with SE, p-value, and 95% CI. Bayesian factors (BF10) reported.","Correlation coefficients (r), 95% bootstrap CI, BF10 (Bayes factors), t-statistics, p-values reported. Figure 1 and text report r=-0.040 (95% CI [-0.0605, -0.0186]), BF10=13.10; year 2: r=-0.0933 (95% CI [-0.1231, -0.0635]), BF10=428995.74; mediation indirect effect: B=-6.920e-5, p<0.001",,MET,MET,,MET,Original empirical analysis of ABCD baseline and year 2 follow-up data examining screen exposure time effects on inhibitory control network (fronto-striatal connectivity). Not a measurement paper—primary outcome is SM ↔ brain connectivity (not just concordance/validity). Not review/protocol/resource paper. Cite: entire Methods and Results sections.,Original ABCD Study analysis examining association between screen time and inhibitory control network development over 2-year period,,MET,MET,,MET,"Published in Developmental Cognitive Neuroscience, 2023, volume 60:101218 (doi: 10.1016/j.dcn.2023.101218). Received 16 February 2022, accepted 15 February 2023. No evidence of prior preprint or duplicate.",Published in Developmental Cognitive Neuroscience (2023); no duplicate evidence,,FALSE,FALSE,,FALSE,"Condition (a) FAILS: Paper is explicitly SM→brain outcome (screen exposure predicts fronto-striatal connectivity development), NOT demographic→SM as DV. Paper includes SM as IV throughout. Conditions (b) and (c) not applicable. This is NOT demographic-only→SM analysis. FT-EC7 does NOT apply.","Screen time is independent variable predicting neurobiological outcome (fronto-striatal connectivity), not dependent variable. Analysis includes non-demographic predictors (reward sensitivity/BAS scores) and outcome relationships. Not demographic-only→SM framework. B18/B20 not applicable.",
103,NowIKnowMyABCD: A global resource hub for researchers using data from the ABCD Study.,,2024,10.1016/j.dcn.2024.101388,True,EXCLUDE,FT-EC2,FT_IC2 = NOT_MET,MET,MET,,MET,"ABCD Study resource; focuses on the dataset involving 11,000+ US youth","Describes ABCD Study involving over 11,000 youth and families",,UNKNOWN,NOT_MET,NOT_MET,NOT_MET,Resource/documentation paper does not report data on specific smartphone or SM variables,Paper is a resource hub describing support infrastructure for ABCD researchers. No smartphone or social media data analysis. Discussion board mentions SM in a live feed from Twitter but does not report SM or smartphone measurements or variables in original analysis. B14 applies.,"B14 applies: editorial, commentary, perspective, or resource paper with no original ABCD analysis → FT_IC5 = NOT_MET (FT-EC3). By extension, no qualifying SM/smartphone variables are measured. This is a documentation paper, not a data analysis paper. FT_IC2 = NOT_MET.",UNKNOWN,NOT_MET,NOT_MET,NOT_MET,No empirical statistical analyses; this is a documentation/resource paper,Paper reports no inferential statistical tests on SM or smartphone data. Descriptive resource paper only.,B14 applies to resource/documentation papers. No empirical analysis; purely descriptive documentation. FT_IC3 = NOT_MET (no inferential test).,NOT_MET,NOT_MET,,NOT_MET,No numeric data extracted from empirical analysis,"No numeric SM or smartphone coefficients, correlations, or test statistics reported",,NOT_MET,NOT_MET,,NOT_MET,Resource/documentation paper (B14). Describes a help platform and discussion board for ABCD researchers; no original empirical analysis,"FT-EC3 / B14 applies: this is a resource/protocol paper, not an empirical analysis. Describes infrastructure, discussion board, tutorials, and communication tools. No original data analysis reported.",,MET,MET,,MET,Unique 2024 publication,Published 2024 in Developmental Cognitive Neuroscience. No evidence of duplicate.,,FALSE,FALSE,,FALSE,"FT_EC7 does not apply; FT_IC5 is NOT_MET (resource paper, not empirical analysis)",FT_IC5 NOT_MET; does not qualify for EC7 assessment. Paper fails on IC5 (resource/protocol paper per B14).,
105,Association of cyberbullying victimization and substance initiation: The Adolescent Brain Cognitive Development (ABCD) study,,2023,10.1016/j.drugalcdep.2023.110920,True,EXCLUDE,FT-EC2,FT_IC2 = NOT_MET,MET,MET,,MET,"ABCD Study; 10,335 eligible participants at Year 2 (mean age 12); longitudinal follow-up to Year 3 (mean age 13).","ABCD study with 10,335 participants at year 2 (ages 10-14) and 6,095 at year 3",,NOT_MET,NOT_MET,,NOT_MET,Cyberbullying alone reported as exposure. Per B3: Cyberbullying without separately-measured SM coefficient = NOT_MET. Paper reports cyberbullying victimization predicting substance use initiation; no separate SM exposure measure or coefficient.,Cyberbullying victimization measured alone; no separately-measured SM variable with its own coefficient. Applies B3: cyberbullying alone without concurrent SM measure and separate coefficients → NOT_MET,,MET,NOT_MET,NOT_MET,NOT_MET,Multivariable logistic regression; cross-sectional analysis at Year 2 and longitudinal analysis Year 2 → Year 3; odds ratios (OR) and 95% CIs reported.,"No SM-specific coefficient; cyberbullying is sole exposure, predicting substance initiation; no SM ↔ non-SM outcome coefficient","B3: Paper measures cyberbullying as the only screen-adjacent variable → FT_IC2 = NOT_MET (FT-EC2). Cyberbullying alone does not satisfy FT-IC2 per criteria §2.2.2: requires cyberbullying PLUS a separately-measured smartphone/SM variable with its own coefficient. Since FT_IC2 fails under B3, the paper has no qualifying SM variable to test. Therefore, FT_IC3 = NOT_MET: no inferential test linking a qualifying SM variable to a non-SM outcome.",MET,NOT_MET,NOT_MET,NOT_MET,"ORs and 95% CIs reported in Tables 2 (main text): e.g., OR=2.17 [1.68, 2.81] for lifetime cyberbullying; OR=2.22 [1.68, 2.93] for longitudinal association.",No SM numeric coefficient to extract; only cyberbullying OR reported,"FT_IC4 requires a numeric value for a qualifying SM ↔ non-SM association. Under B3, cyberbullying is the only screen-adjacent variable; no separately-measured SM variable exists. Therefore, FT_IC4 = NOT_MET.",MET,MET,,MET,Original empirical analysis of ABCD Study data examining association between cyberbullying victimization and substance initiation.,Original ABCD analysis; cross-sectional (year 2) and prospective (year 2→3) multivariable logistic regression,,MET,MET,,MET,Published original article; no evidence of duplicate.,Original 2023 publication; no duplicate,,FALSE,FALSE,,FALSE,FT-IC2 NOT_MET disqualifies FT-EC7 evaluation. Cyberbullying alone without separately-measured SM fails binding rule B3.,"SM is not the dependent variable; cyberbullying (measured via online/social media context) is the IV, not SM itself; fails condition (a)",
106,Prospective association between screen use modalities and substance use experimentation in early adolescents.,,2025,10.1016/j.drugalcdep.2024.112504,True,INCLUDE,,all criteria MET; FT-EC7 not applicable,MET,MET,,MET,"US ABCD Study, prospective analysis of Year 2 and Year 3 follow-up (2018-2021, baseline 2016-2018), 8006 adolescents mostly 11-12 years old at Year 2, recruited from 21 sites across the United States.","Prospective cohort analysis of ABCD Study year 2→year 3 follow-up (2018-2021), ages 11-12 at year 2, US national sample of 8006 adolescents",,MET,MET,,MET,"Multiple qualifying screen modalities: (1) social media (0.7 ± 1.6 h/d) per B1; (2) texting (0.7 ± 1.5 h/d) per B1 (smartphone texting qualifies); (3) video chatting (0.5 ± 1.3 h/d) per B1 (video chat on phone qualifies). All three are qualifying smartphone/SM variables. Non-qualifying modalities (TV/movies, videos, single/multi-player games, internet) are also included but do not disqualify per B1 (separate coefficients reported for each modality).","Social media use (hours/day), texting (hours/day), video chatting (hours/day). All three are qualifying SM/smartphone variables. Separate coefficients reported for each. Applies B1: distinct coefficients for SM, texting, video chat as screen modalities",,MET,MET,,MET,Logistic regression analyses testing prospective associations between screen time (Year 2) and substance use experimentation (Year 3). For social media: AOR 1.20 (95% CI 1.14-1.26) for any substance; AOR 1.15 (95% CI 1.10-1.21) for alcohol; AOR 1.23 (95% CI 1.14-1.32) for nicotine; AOR 1.22 (95% CI 1.13-1.33) for cannabis. For texting: AOR 1.18 (95% CI 1.12-1.24) for any substance; AOR 1.14 (95% CI 1.08-1.20) for alcohol; AOR 1.16 (95% CI 1.06-1.26) for nicotine; AOR 1.18 (95% CI 1.08-1.29) for cannabis. For video chatting: AOR 1.09 (95% CI 1.03-1.16) for any substance; AOR 1.14 (95% CI 1.07-1.22) for nicotine; AOR 1.13 (95% CI 1.03-1.24) for cannabis.,"Logistic regression analyses evaluating prospective associations between screen time (year 2) and substance use experimentation (year 3); AORs with 95% CIs reported in Figure 1 and text for alcohol, nicotine, cannabis, and any substance use",,MET,MET,,MET,"Figure 1 and results text report AOR (adjusted odds ratios) with 95% CI for all screen modalities vs. substance use outcomes. All numeric extractable: AOR, 95% CI, p-values indicated by asterisks (*) for Benjamini-Hochberg adjusted significance.",AORs with 95% CIs reported: social media AOR 1.20 (95% CI 1.14-1.26); texting AOR 1.18 (95% CI 1.12-1.24); video chatting AOR 1.09 (95% CI 1.03-1.16); substance-specific ORs in Figure 1,,MET,MET,,MET,"Original empirical prospective cohort analysis of ABCD Study data using logistic regression models predicting substance use experimentation in Year 3 from screen use in Year 2, adjusting for covariates and baseline substance use.",Original prospective empirical analysis of ABCD Study; logistic regression testing associations between screen time modalities and subsequent substance use experimentation,,MET,MET,,MET,"Published full-text article in Drug and Alcohol Dependence, 2025, no indication of duplicate publication.",Full journal publication; no evidence of preprint/abstract/deposit duplicate,,FALSE,FALSE,,FALSE,"Paper does not meet FT-EC7 criteria. SM/screen modalities are INDEPENDENT variables (Year 2), not dependent variables. Analysis structure is screen use→substance use outcome, not demographics→SM. Prospective but does not fit FT-EC7 binding structure (demographics-only→SM as DV, longitudinal).","SM/smartphone is independent variable (predictor), not dependent variable; prospective analysis with substance use experimentation as outcome; does not meet FT_EC7 criteria (which requires SM as DV with demographics-only predictors)",
107,Cannabis expectancies mediate the association between social media use and cannabis experimentation in early adolescents: A prospective cohort study.,,2025,10.1016/j.drugalcdep.2025.112947,True,INCLUDE,,all criteria MET; FT-EC7 not applicable,MET,MET,,MET,"Adolescent Brain Cognitive Development (ABCD) Study, US longitudinal cohort (N=7691, ages 9-10 at baseline, assessed Year 2-4)","Adolescent Brain Cognitive Development (ABCD) Study, N=7691, Year 2-4 follow-up (2018-2022)",,MET,MET,,MET,"Daily social media time measured via ABCD Youth Screen Time Survey; participants reported typical hours per day on social media (Facebook, Instagram, Twitter/X) with weighted average calculation. Qualifies as time on SM per binding rule B1.",Social media time (daily hours) measured at Year 2; qualifying SM variable per B1,,MET,MET,,MET,Sequential modeling approaches using generalized structural equation modeling (GSEM) to estimate direct and indirect effects; mediation analysis testing cannabis expectancies as mediator of social media→cannabis experimentation pathway,Sequential modeling/GSEM with indirect effects quantified; mediation analysis testing SM→expectancies→cannabis experimentation pathway,,MET,MET,,MET,"Direct effect B=0.18 (95% CI: 0.13–0.24, p<0.001) for social media time→cannabis experimentation. Indirect effects reported: positive expectancies B=0.05 (95% CI: 0.03–0.06), negative expectancies B=0.03 (95% CI: 0.02–0.04)","B coefficients and 95% CI reported: social media→cannabis experimentation B=0.18 (95% CI 0.13-0.24, p<0.001); positive expectancy indirect effect B=0.05 (95% CI 0.03-0.06, p<0.001)",,MET,MET,,MET,Original ABCD analysis examining prospective association between social media time (Year 2) and cannabis experimentation (Year 4) with cannabis expectancies (Year 3) as mediator,Original prospective analysis on ABCD cohort testing mediation pathways,,MET,MET,,MET,No evidence of preprint/abstract/duplicate. Published online 25 October 2025 in Drug and Alcohol Dependence,Published version with no clear preprint/duplicate identified,,FALSE,FALSE,,FALSE,"SM is independent variable predicting cannabis experimentation (outcome), not dependent variable. Paper does NOT meet FT_EC7 criteria: (a) fails because SM→outcome analysis is present (not SM as sole DV), and (b) includes confounders beyond demographics (friends' cannabis use)","SM is independent variable (IV) predicting cannabis experimentation outcome, not dependent variable. SM→outcome analysis present, violating condition (a) of FT-EC7",
