paper_id,doi,title,first_author,year,journal,has_pdf,L1_decision,FT_IC1_C1,FT_IC1_C2,FT_IC1_RESOLVE,FT_IC1_FINAL,FT_IC1_C1_evidence,FT_IC1_C2_evidence,FT_IC1_RESOLVE_evidence,FT_IC2_C1,FT_IC2_C2,FT_IC2_RESOLVE,FT_IC2_FINAL,FT_IC2_C1_evidence,FT_IC2_C2_evidence,FT_IC2_RESOLVE_evidence,FT_IC3_C1,FT_IC3_C2,FT_IC3_RESOLVE,FT_IC3_FINAL,FT_IC3_C1_evidence,FT_IC3_C2_evidence,FT_IC3_RESOLVE_evidence,FT_IC4_C1,FT_IC4_C2,FT_IC4_RESOLVE,FT_IC4_FINAL,FT_IC4_C1_evidence,FT_IC4_C2_evidence,FT_IC4_RESOLVE_evidence,FT_IC5_C1,FT_IC5_C2,FT_IC5_RESOLVE,FT_IC5_FINAL,FT_IC5_C1_evidence,FT_IC5_C2_evidence,FT_IC5_RESOLVE_evidence,FT_IC6_C1,FT_IC6_C2,FT_IC6_RESOLVE,FT_IC6_FINAL,FT_IC6_C1_evidence,FT_IC6_C2_evidence,FT_IC6_RESOLVE_evidence,FT_EC7_C1,FT_EC7_C2,FT_EC7_RESOLVE,FT_EC7_FINAL,FINAL_DECISION,FINAL_EXCLUSION_CODE,FINAL_FAILED_CRITERION
473,10.2196/29426,Passive Sensing of Preteens' Smartphone Use: An Adolescent Brain Cognitive Development (ABCD) Cohort Substudy.,"Wade, Natasha E",2021,JMIR mental health,1,INCLUDE,MET,MET,MET,MET,Uses ABCD Study subsample. Methods: 'Four ABCD study sites that were roughly geographically dispersed... Four ABCD study sites participated in this pilot substudy project... 67 participants (aged 11-12 years)' from the larger ABCD cohort. Participants recruited as part of ABCD study 2-year follow-up.,"Uses U.S. ABCD Study, subsample of 67 participants (ages 11-12 years), pilot substudy described as part of ABCD implementation",ABCD Study subsample of 67 participants aged 11-12 years recruited as part of ABCD's 2-year follow-up. Described as 'Four ABCD study sites participated in this pilot substudy project',MET,MET,MET,MET,"Measures specific smartphone use variables via passive sensing. Methods: 'passive, objective phone app methods for assessing smartphone screen use' including 'streaming (mean 1 hour 57 minutes per day... communication (mean 48 minutes per day... gaming (mean 41 minutes per day... and social media (mean 36 minutes per day).' Results: Table 1 lists streaming, YouTube, communication, gaming, social media, SMS, reading, music, and news as measured app categories.","Measures passive sensing of smartphone screen use by app category (streaming, communication, gaming, social media). From abstract: 'passively sense smartphone screen use by time and types of apps used.' Table 1 breaks down app categories.","Measures passive sensing of smartphone screen use via EARS app with specific app category breakdown. Methods: 'passively sense smartphone screen use by time and types of apps used.' Table 1 lists: streaming (1h 57min/day), YouTube (1h 18min/day), communication (48min/day), gaming (41min/day), social media (36min/day), SMS (6min/day), reading, music, news. Smartphone-specific variables extracted.",MET,NOT_MET,NOT_MET,NOT_MET,Reports correlation and inferential analyses. Results: 'Self-report of smartphone screen use was partly consistent with objective measurement (r=0.49)' with significance testing. Methods: 'Analyses of variance were run to assess differences in categorical app use by demographics.' Pearson correlations and paired sample t-tests reported.,"Paper reports correlations between passive sensing data and self-report (r=0.49) and parent report (r=0.61), but these are measurement concordance tests, not associations between smartphone/SM and external non-SM outcomes. No inferential tests linking smartphone use to behavioral, mental health, or clinical outcomes reported. Per E5, measurement papers must also report phone/SM↔non-SM association; this paper only validates measurement agreement.","Per E5 and guideline, measurement papers must report phone/SM↔non-SM association to satisfy FT_IC3. This paper reports only measurement concordance: 'Self-report of smartphone screen use was partly consistent with objective measurement (r=0.49)' and 'Analyses of variance were run to assess differences in categorical app use by demographics.' These are measurement validation tests, not associations between smartphone/SM use and external non-SM outcomes (behavioral, mental health, clinical). No inferential test linking smartphone use to outcomes like sleep, academic performance, mental health, etc.",MET,MET,MET,MET,"Reports correlation coefficients, means, standard deviations, and p-values. Results: 'r=0.49, P<.001' for self-report vs passive sensing correlation; Table 2 reports means (SD) for self-report and EARS app use; Figure 1 shows r=.49, P<.001 for parent-report correlation.",Reports correlation coefficient r=0.49 (between passive sensing and self-report) and descriptive statistics (mean app use times in Table 1),Reports correlation coefficient r=0.49 (p<.001) between passive sensing and self-report; descriptive statistics in Table 1 (means and SDs for app use times),MET,NOT_MET,NOT_MET,NOT_MET,"Original empirical measurement/validation study. Study design: feasibility and validation substudy within ABCD examining correspondence between passive sensing and self-report/parent-report of smartphone screen use, plus app use differences by demographics.",This is a measurement/feasibility paper describing passive sensing protocol and validating EARS app concordance with self/parent report. No original analysis linking smartphone use to external outcomes. Per guideline: 'psychometric-only (factor structure / reliability without external outcome)' = NOT_MET,Per criteria: 'psychometric-only (factor structure / reliability without external outcome)' = NOT_MET. This is a measurement/feasibility/validation study of the EARS app describing passive sensing protocol and concordance between EARS and self/parent report. The abstract and methods explicitly frame this as a feasibility/acceptability study with no analysis linking smartphone use to external outcomes. E5 states measurement papers must 'also report a phone/SM↔non-SM association'; this fails that requirement.,MET,MET,MET,MET,"Journal article published in JMIR Mental Health, 2021;8(10):e29426. Not a preprint, conference abstract, or duplicate.","Published journal article, JMIR Mental Health, 2021, DOI: 10.2196/29426","Published journal article in JMIR Mental Health, 2021;8(10):e29426, DOI 10.2196/29426. Peer-reviewed article, not preprint or duplicate.",False,False,False,False,EXCLUDE,FT-EC3,FT_IC5
521,10.3389/fped.2023.1198033,Passive and social screen time in children with autism and in association with obesity.,,2023,Frontiers in pediatrics,1,INCLUDE,MET,MET,,MET,"Uses U.S. ABCD Study baseline data from 10,842 participants, children aged 9-10 years from 21 sites","Uses U.S. ABCD Study baseline data from 10,842 participants enrolled 2016-2018",,MET,MET,,MET,"Measures specific phone/SM variables: passive screen use (television/movies/watching videos), playing video games, social media (visiting social networking sites such as Facebook, Instagram and video-chatting), and texting","Measures specific smartphone/SM variables: passive screen use (TV/movies/videos), playing video games, social media sites/video chat, texting. All reported separately.",,MET,MET,,MET,"Generalized linear models with Poisson distribution and logistic regression. Inferential tests reported: chi-square tests and comparisons by autism status with ratio of means, e.g., passive viewing p < 0.001, video games p = 0.001","Reports t-tests and logistic/Poisson regression: screen time duration by autism status (Table 2: p < 0.001, 0.002, 0.001, 0.03, 0.04), obesity prevalence ratios (Tables 3-5: p = 0.002, 0.05, 0.04)",,MET,MET,,MET,"Numeric values throughout: means, ratio of means with 95% CI, prevalence ratios with 95% CI, p-values (e.g., Table 3: passive screen time p = 0.002, video games p = 0.05, texting p = 0.04)","Reports p-values, t-statistics, prevalence ratios with 95% CI throughout tables. Examples: boys autism TV 2.9h vs TD 2.3h p < 0.001; obesity/passive viewing p = 0.002 PR 2.15 (1.40-3.31)",,MET,MET,,MET,Original empirical cross-sectional analysis from ABCD baseline data examining screen time and obesity association,Original empirical cross-sectional analysis using propensity score matching and generalized linear models with Poisson/binomial distributions,,MET,MET,,MET,"Published journal article, Frontiers in Pediatrics, 2023",Journal article published July 2023 in Frontiers in Pediatrics. No indication of preprint/duplicate status.,,False,False,,False,INCLUDE,,
101,10.1016/j.dcn.2023.101218,Negative impact of daily screen use on inhibitory control network in preadolescence: A two-year follow-up study.,"Chen, Ya-Yun",2023,Developmental cognitive neuroscience,1,INCLUDE,MET,MET,MET,MET,"Uses ABCD data: 8,324 children at baseline (ages 9-11 years, M=119.28 months) and 3,891 at 2-year follow-up from the ABCD 2.0 release","Uses ABCD Study data: 8,324 children aged 9-11 years analyzed for neuropsychological associations","Uses ABCD Study data: baseline N=8,324 children aged 9-11 years (M=119.28 months); 2-year follow-up N=3,891. ABCD 2.0 release used",MET,MET,MET,MET,Measures screen time with Screen-Activity Proportion (SAP) score computed from child self-report questionnaire of daily screen time across modalities,"Measures 'daily screen time' as specific exposure variable; abstract specifies screen time linked to inhibitory control, reward sensitivity, fronto-striatal connectivity","Measures daily screen time via Screen-Activity Proportion (SAP) score computed from child self-report of screen time on: TV, videos, video games, texting, social media, video chat. Score reflects proportion of time on screens vs non-screen activities",MET,MET,MET,MET,"Correlation analyses, mediation analysis with bootstrapping, and group comparisons. Inferential statistics reported: baseline r = −0.040 (p < 0.001 by Bayes factor), year 2 r = −0.0933 (BF10 = 428995.74), group t-tests (t(1571) = 3.043, p = 0.002)",Reports mediation analysis with statistical inference: 'screen time mediated the effect of reward sensitivity on development of inhibitory control system...over two year period' with neuropsychological outcomes (non-SM),"Correlation analyses, mediation analysis with bootstrapping, and group comparisons testing screen time associations with neural and behavioral outcomes. Reported: r = -0.040 (p < 0.001 by Bayes factor, BF10 = 13.10) for baseline; r = -0.0933 (BF10 = 428995.74) for year 2 connectivity",MET,UNKNOWN,MET,UNKNOWN,"Correlation coefficients, bootstrap 95% CIs, Bayes factors, p-values, Cohen's d, independent t-tests reported throughout (e.g., 'r = −0.0933, 95% CI [−0.1231, −0.0635]')","Abstract describes findings but does not provide explicit β, OR, p-values, or other numeric statistics. Full PDF text needed to confirm presence of numeric coefficients; cannot extract from abstract alone.","Multiple numeric statistics reported: correlation coefficients, 95% bootstrap CIs, Bayes factors, p-values, Cohen's d, independent t-tests. Example: r = -0.0933, 95% CI[-0.1231, -0.0635], BF10 = 428995.74; mediation indirect effect B = -6.920e-5, p < 0.001",MET,MET,MET,MET,Original empirical longitudinal analysis using baseline and 2-year follow-up data examining screen time effects on fronto-striatal connectivity,Original empirical longitudinal analysis: mediation model predicting changes in fronto-striatal connectivity and inhibitory control over two-year period,Original empirical longitudinal analysis examining baseline and 2-year follow-up data. Mediation analysis included (screen time → reward sensitivity → inhibitory control network development),MET,MET,MET,MET,"Published journal article, Developmental Cognitive Neuroscience, 2023",Journal article published 2023 in Developmental Cognitive Neuroscience. No duplicate indication.,"Published journal article in Developmental Cognitive Neuroscience, 2023. Not identified as preprint or duplicate",False,False,False,False,UNSURE,,
160,10.1016/j.ypmed.2023.107452,Screen time and suicidal behaviors among U.S. children 9-11Â years old: A prospective cohort study.,"Chu, Jonathan",2023,Preventive medicine,1,INCLUDE,MET,MET,,MET,"Uses ABCD Study data (N=11,633 at baseline, analyzed N=11,633 with complete data) ages 9-11 years","Uses ABCD Study prospective cohort data: N=11,633 children aged 9-11 years at baseline",,MET,MET,,MET,"Measures specific screen time modalities: total screen time, texting, video chatting, watching videos, playing video games reported separately from ABCD Youth Screen Time Survey","Measures multiple specific smartphone/SM variables: total screen time, texting, video chatting, watching videos, playing video games. All modalities separately quantified.",,MET,MET,,MET,"Logistic regression analyses with inferential statistics reported. Each additional hour of screen time associated with 1.09 higher odds (95% CI 1.03–1.14). Specific modalities: texting aOR 1.36 (95% CI 1.06–1.74), video chatting aOR 1.30 (95% CI 1.03–1.65), videos aOR 1.21 (95% CI 1.04–1.39), video games aOR 1.18 (95% CI 1.01–1.38)","Reports logistic regression: 'Each additional hour of total screen time was prospectively associated with 1.09 higher odds of suicidal behaviors' (aOR 1.09, 95% CI 1.03-1.14); modality-specific ORs for texting, video chat, videos, video games",,MET,MET,,MET,Adjusted odds ratios (aOR) with 95% confidence intervals reported for all associations (Table 2); p-values derived from logistic regression,"Reports aOR with 95% CIs for multiple associations: total screen aOR 1.09 (1.03-1.14), texting aOR 1.36 (1.06-1.74), video chat aOR 1.30 (1.03-1.65), watching videos aOR 1.21 (1.04-1.39), video games aOR 1.18 (1.01-1.38)",,MET,MET,,MET,"Original empirical prospective cohort study with 2-year follow-up, examining baseline screen time predicting 2-year suicidal behaviors",Original empirical longitudinal analysis: logistic regression modeling baseline screen time (exposure) predicting suicidal behaviors at 2-year follow-up (outcome),,MET,MET,,MET,"Published journal article, Preventive Medicine, 2023",Journal article published 2023 in Preventive Medicine. No preprint or duplicate indication.,,False,False,,False,INCLUDE,,
193,10.1038/s41598-024-68467-8,Passively sensing smartphone use in teens with rates of use by sex and across operating systems.,"Alexander, Jordan D",2024,Scientific reports,1,INCLUDE,MET,MET,,MET,"Uses U.S. ABCD Study data: 'Through the longitudinal, U.S.-based Adolescent Brain Cognitive Development (ABCD) Study, youth (mage=14; n=1415) self-reported their typical smartphone use and passively recorded three weeks of smartphone use via the ABCD-specific Effortless Assessment Research System (EARS) application.'","Uses U.S. ABCD Study data; n=1,415 participants at baseline (ages 9-10)",,MET,MET,,MET,Measures specific smartphone use variables via EARS: 'we describe and validate passively-sensed smartphone keyboard and app use measures' and 'Keyboard and app-use measures were reliable and positively correlated' (r=0.33). Also self-reported smartphone use measured.,"Measures passive sensing smartphone use via ABCD-EARS application: keyboard use, app use, passive sensing data; text: 'ABCD-EARS application recorded (1) the active application in the foreground of the participant's phone, (2) the application's App Store/Play Store category, (3) the number of keystrokes input'",,NOT_MET,NOT_MET,,NOT_MET,No reported association between smartphone/SM variable and non-SM outcomes. Paper provides descriptive statistics and validates EARS measures but does not report inferential tests linking smartphone use to any outcome variable. It is a measurement/validation paper only.,"Only validation study comparing passive measures (keyboard use, app use) to self-report correlations; no association test to non-SM outcome. Reports: 'Keyboard and app-use measures were reliable and positively correlated with one another (r=0.33) and with self-reported use (rs=0.21-0.35)' but these are screen-to-screen validation, not SM→non-SM associations",,NOT_MET,MET,,UNKNOWN,"While numeric values are reported (correlations r=0.33, r=0.21-0.35), these are only for validation of EARS vs self-report concordance, not for smartphone/SM → outcome associations.","Reports correlation coefficients: r=0.33 (keyboard-app), rs=0.21-0.35 (self-report concordance)",,NOT_MET,NOT_MET,,NOT_MET,"This is a measurement/validation paper without empirical analysis of external outcomes. Does not report phone/SM ↔ non-SM associations. Fails FT-IC3 criterion. Per E5, measurement papers must report external outcome to count.","Measurement and validation paper only; reports passively-sensed smartphone use measures and their reliability/concordance with self-report, but does not report association between smartphone/SM variable and a non-SM outcome",,MET,MET,,MET,"Published empirical research article in Scientific Reports (2024), not a preprint, conference abstract, or duplicate.",Journal article published in Scientific Reports 2024,,False,False,,False,EXCLUDE,FT-EC3,FT_IC5
103,10.1016/j.dcn.2024.101388,NowIKnowMyABCD: A global resource hub for researchers using data from the ABCD Study.,"Ali, Sana A",2024,Developmental cognitive neuroscience,1,INCLUDE,MET,MET,,MET,"Uses U.S. ABCD Study data: 'The Adolescent Brain and Cognitive Development (ABCD) Study, involving over 11,000 youth and their families, is a groundbreaking project examining various factors impacting brain and cognitive development.'","Discusses ABCD Study: 'The Adolescent Brain and Cognitive Development (ABCD) Study, involving over 11,000 youth and their families, is a groundbreaking project'",,NOT_MET,NOT_MET,,NOT_MET,No measurement of specific smartphone or social media variables. This is a resource/documentation paper describing the NowIKnowMyABCD help platform and discussion board for ABCD researchers. No phone/SM exposure measurement in this paper.,"This is an infrastructure/resource paper describing the NowIKnowMyABCD website and discussion board. Does not measure or report on any specific smartphone or social media variable. Paper focuses on centralized documentation and communication resource platform, not on SM/phone data analysis.",,NOT_MET,NOT_MET,,NOT_MET,No inferential statistical tests linking any variable to outcomes. This is a resource description paper with no empirical analyses.,No statistical tests or associations reported. This is a resource description paper with no empirical analysis of SM/phone variables.,,NOT_MET,NOT_MET,,NOT_MET,"No numeric statistics (β, OR, p-values) reported for any associations.","No numeric values (β, OR, r, p) reported for any SM/phone associations",,NOT_MET,NOT_MET,,NOT_MET,"Not original empirical analysis. This is a resource/tool description paper documenting NowIKnowMyABCD platform. Per E10, describes a resource with no original analysis.",Not an empirical analysis. This is a resource/infrastructure paper describing the development and features of a centralized help platform (website and discussion board) for ABCD researchers. E10 applies: no original analysis present.,,MET,MET,,MET,"Published article in Developmental Cognitive Neuroscience (2024), not a preprint or duplicate.",Journal article published in Developmental Cognitive Neuroscience 2024,,False,False,,False,EXCLUDE,FT-EC2,FT_IC2
140,10.1016/j.jadohealth.2024.06.020,Longitudinal Use Patterns of Technology Subtypes During the Transition Into Early Adolescence: Results From the Adolescent Brain Cognitive Development Study.,"Borodovsky, Jacob T",2024,The Journal of adolescent health : official publication of the Society for Adolescent Medicine,1,INCLUDE,MET,MET,MET,MET,"Uses U.S. ABCD Study data: 'N = 11,868 participants in the Adolescent Brain Cognitive Development study followed from ages ~9/10 to ~13/14.' Methods state 'We used data from the ABCD longitudinal cohort study. ABCD study recruited youth and parents at 21 United States sites.'","Uses ABCD Study data: 'N = 11,868 participants in the Adolescent Brain Cognitive Development study followed from ages ~9/10 to ~13/14'","Uses U.S. ABCD Study data: N=11,868 participants in the Adolescent Brain Cognitive Development study followed from ages ~9/10 to ~13/14 across 21 United States sites.",MET,MET,MET,MET,"Measures multiple specific smartphone and social media variables: 'We examined youths' self-reported hours per day (hr/day) of technology subtypes: TV/Movies, video games, YouTube, social media, video chat, and texting.' Social media specifically measured as 'social media' outcome; texting on cell phone; video chat; YouTube (all phone-related).","Measures multiple specific technology subtypes: social media, texting, video chat, YouTube, TV/movies, video games. Text: 'youths' self-reported hours per day (hr/day) of technology subtypes: TV/Movies, video games, YouTube, social media, video chat, and texting'","Measures specific smartphone and social media variables: self-reported hours per day of social media (named platforms: Facebook, Twitter, Instagram, Snapchat, TikTok), texting on cell phone, video chat, YouTube, TV/Movies, and video games. All qualify as specific phone/SM variables.",MET,MET,MET,MET,"Reports multilevel logistic regression and correlation tests linking technology subtypes to sociodemographic outcomes: 'Using child-reported hours of technology use, increases in the subject-specific odds of using a technology >2 hr/day ranged from 25% (YouTube; 95% CI: 1.16–1.35) to 234% (social media; 95% CI: 3.14–3.55).' Also reports associations with biological sex, parental education, income, marital status via multilevel logistic regression.","Multilevel logistic regression examining associations between technology subtypes and sociodemographic variables (sex, parent education, income, marital status). Both cross-sectional and longitudinal analyses. E.g., 'Using child-reported hours of technology use, increases in the subject-specific odds of using a technology >2 hr/day ranged from 25% (YouTube; 95% CI: 1.16-1.35) to 234% (social media; 95% CI: 3.14-3.55)'","Multilevel logistic regression examining associations between technology subtypes (social media, texting, video chat, YouTube, TV, video games) and sociodemographic outcomes (biological sex, parent education, income, marital status). Inferential tests reported with statistics throughout. Example: 'increases in the subject-specific odds of using a technology >2 hr/day ranged from 25% (YouTube; 95% CI: 1.16–1.35) to 234% (social media; 95% CI: 3.14–3.55).'",MET,MET,MET,MET,"Multiple numeric statistics reported: ORs with 95% CIs (e.g., 'social media; 95% CI: 3.14–3.55'), correlation coefficients (rs range: 0.13–0.29), test statistics throughout Table 2.","Reports OR with 95% CI for multiple associations: social media OR 3.34 (95% CI: 3.14, 3.55); TV OR 2.16 (95% CI: 2.09, 2.23); texting OR 2.22 (95% CI: 2.07, 2.39); video chat OR 1.79 (95% CI: 1.67, 1.93); YouTube OR 1.25 (95% CI: 1.16, 1.35); video games OR 2.11 (95% CI: 2.04, 2.18). Table 2 provides extensive ORs with CIs.","Multiple ORs with 95% CIs reported in Table 2: social media OR 3.34 (95% CI: 3.14, 3.55), TV OR 2.16 (95% CI: 2.09, 2.23), video games OR 2.11 (95% CI: 2.04, 2.18), texting OR 2.22 (95% CI: 2.07, 2.39), video chat OR 1.79 (95% CI: 1.67, 1.93), YouTube OR 1.25 (95% CI: 1.16, 1.35).",MET,MET,MET,MET,Original empirical longitudinal analysis: 'We used multilevel logistic regression to examine participant-specific changes and between-subject heterogeneity in the probability of engaging with each technology for more than two hours per day.',Original empirical analysis: 'We used multilevel logistic regression to examine participant-specific changes and between-subject heterogeneity in the probability of engaging with each technology for more than two hours per day' with longitudinal data across 5 waves,Original empirical longitudinal analysis using multilevel logistic regression to examine participant-specific changes and between-subject heterogeneity in probability of technology use >2 hours per day across 5 waves of data (ages 9/10 to 13/14).,MET,MET,MET,MET,"Published article in Journal of Adolescent Health (2024), not a preprint or duplicate.",Journal article published in Journal of Adolescent Health 2024,"Published peer-reviewed journal article in Journal of Adolescent Health, 2024. Not a preprint, conference abstract, or duplicate.",True,False,False,False,INCLUDE,,
